name,id,organizations,services,service_id,title,department,email,phones,x-details
Bellingham Public Schools Homeless Liaison,recspQ7EvvkPjZbcU,,McKinney-Vento Program (BPS),recKlSBx8iAwGDZ4d,,,,"(360) 393-8738,(360) 306-2462,(360) 303-1588",
Blaine School District Homeless Liaison,recctfnIoHA9NVl9w,,McKinney-Vento Program (BSD) ,recIlYV4og2CVNuY6,,,,(360) 332-0740,
Ferndale School District Homeless Liaison,recaSPWwyy2UUw1UY,,McKinney-Vento Program (FSD),recaOegM5HETvhoyx,,,,(360) 383-9432,
Lummi Nation School Homeless Liaison,recpBzgkBo86itnS0,,McKinney-Vento Program (Lummi),recPZTciHM4NMoX8a,,,,(360) 758-4337,
Lynden School District Homeless Liaison,recthHnE1kn8aBHOC,,McKinney-Vento Program (LSD),recgy9ZHEijmTyRvx,,,,(360) 354-1549,
Meridian School District Homeless Liaison,rec7fjLjIKDIXy52k,,,,,,,(360) 318-2486,
Mount Baker School District Family Services Coordinators,reclHDqngV42uy4Hj,,"Mt. Baker Family Services,McKinney-Vento Program (MBSD)","recWQKS9hKAz1Hz23, reclfUbfxMULFVpr5",,,,(360) 617-4511,
Nooksack Valley School District Homeless Liaison,recR9qt0r7zwZf4OE,,McKinney-Vento Program (NVSD),recCmn8hzKmtAN8lt,,,,(360) 988-4754,