name,organizations,organization_id,alternate_name,description,locations,location_id,url,email,phones,contacts,taxonomy,taxonomy_term_id,address,id,status,application_process,interpretation_services,wait_time,fees,accreditations,licenses,schedule,x-details,y-org status,programs
PeaceHealth Women's Health,PeaceHealth,recHPMygwYXm5vTh5,,"The women’s health specialists at PeaceHealth help a woman manage   her body’s changing needs through all of life’s stages — from adolescence to the senior years. Team members may include gynecologists, obstetricians, nurse practitioners, certified mid-wives, pelvic floor specialists or gynecologic surgeons. Conditions treated include benign (noncancerous) gynecologic conditions, bladder or bowel leakage, gynecological cancer, and pelvic problems. ","PeaceHealth OB/GYN at Cordata South,St. Joseph Medical Center","rech4TtOw5nAPiTIr, reciMcRIFF83bOfEl",https://www.peacehealth.org/services/womens-health,,"(360) 752-5280,(360) 738-6361",,"Health,Women's Health,Women","reciYkvwqodZbQOxg, recoXmcooepmDKEv9, recuSuhL2AOVAjlgS","4465 Cordata Pkwy.,2901 Squalicum Pkwy.",recSOkIm5nD6MNRBX,,,,,,,,,,Vetted,
PeaceHealth Emergency Medicine,PeaceHealth,recHPMygwYXm5vTh5,,"The emergency department offers around-the-clock care for serious illnesses and injuries, including heart attack and stroke. Conditions treated include behavioral health emergencies, brain & spine trauma, cerebrovascular emergencies, heart emergencies, orthopedic injuries, overdoses or poisonings, pregnancy complications, respiratory emergencies, and traumatic injuries.",St. Joseph Medical Center,reciMcRIFF83bOfEl,https://www.peacehealth.org/services/emergency-medicine,,(360) 734-5400,,"Emergency,Health,Medical Care,Psychiatric Emergency Services","recv9Cso39oBw8MCb, reciYkvwqodZbQOxg, recAt1RYmyx0kOuIt, recEw2UYJyzNSxsk5",2901 Squalicum Pkwy.,recSJOG0p7meedh6w,,,,,,,,,,Vetted,
Our Little Wishes Enrichment Program,Blue Skies for Children,rec7sW8SKpiIGB0Pv,,"Grants Little Wishes to children ages 6 to 18 for ongoing support of lessons and activities including, but not limited to, art lessons, music lessons, martial arts, team sports, swimming lessons, dance, gymnastics, ice skating, ice hockey, horseback riding, and soccer.​",Blue Skies for Children,recpD00YzHSaqiVat,https://www.blueskiesforchildren.org/programs--applications.html,,(360) 756-6710,,"Financial Assistance,Children,Recreation,Teens","recbgFtOSl3oWCDSE, recH2S9jjAnFPldly, recXSER99ndvVMgCn, rec3MOuAsiEAxOo3z",2505 Cedarwood Ave.,recdHaCEskbFcCs8G,,Visit blueskiesforchildren.org/programs--applications.html for application.,,,,,,,,Vetted,
Our One-Time Little Wishes Program,Blue Skies for Children,rec7sW8SKpiIGB0Pv,,"Grants Little Wishes to children ages 6 to 18 for support of school trip fees, summer camp enrollment fees, bicycle and helmet, special needs equipment, tutoring, computers, school related supplies, sports fees and/or uniforms, cleats, and other items. ",Blue Skies for Children,recpD00YzHSaqiVat,https://www.blueskiesforchildren.org/programs--applications.html,,(360) 756-6710,,"Children,Financial Assistance,Recreation,Supplies for School,Teens","recH2S9jjAnFPldly, recbgFtOSl3oWCDSE, recXSER99ndvVMgCn, rec8OllsKHnHPj5Jo, rec3MOuAsiEAxOo3z",2505 Cedarwood Ave.,recIeIMhlbXI0k3Ev,,Visit blueskiesforchildren.org/programs--applications.html for application.,,,,,,,,Vetted,
Our Little Wishes Instrument Loaner Program,Blue Skies for Children,rec7sW8SKpiIGB0Pv,,"Loans musical instruments to children who wish to participate in their school band or orchestra, but find they are unable to afford the monthly rental cost of an instrument. ",Blue Skies for Children,recpD00YzHSaqiVat,https://www.blueskiesforchildren.org/programs--applications.html,,(360) 756-6710,,"Children,Supplies for School,Teens","recH2S9jjAnFPldly, rec8OllsKHnHPj5Jo, rec3MOuAsiEAxOo3z",2505 Cedarwood Ave.,recVnnTE6B8siosxr,,Visit blueskiesforchildren.org/programs--applications.html for application.,,,,,,,,Vetted,
Blue Skies Shoe Distribution Program,Blue Skies for Children,rec7sW8SKpiIGB0Pv,,"The Spring shoe distribution is scheduled for March / May, and Back to School Shoe Give is scheduled for August / September. An appointment must be scheduled in order to receive an application.. ​",Blue Skies for Children,recpD00YzHSaqiVat,https://www.blueskiesforchildren.org/programs--applications.html,,(360) 756-6710,,"Children,Clothing,Clothes for School,Teens","recH2S9jjAnFPldly, recL3UHuwxQb3U60a, recwWAC5AgF1Jlfsk, rec3MOuAsiEAxOo3z",2505 Cedarwood Ave.,recLGDVTOGCJgJPWR,,"Call to set an appointment, then an application will be mailed to you.",,,,,,,,Vetted,
Blue Skies Back to School Backpack Distribution Program,Blue Skies for Children,rec7sW8SKpiIGB0Pv,,Brand new backpacks are distributed August 1 through mid-September each year. Call for distribution dates. Blue Skies will provide brand new backpacks for up to five children per family.   ,Blue Skies for Children,recpD00YzHSaqiVat,https://www.blueskiesforchildren.org/programs--applications.html,,(360) 756-6710,,"Children,Supplies for School,Teens","recH2S9jjAnFPldly, rec8OllsKHnHPj5Jo, rec3MOuAsiEAxOo3z",2505 Cedarwood Ave.,recv9M0IDwNHP44rO,,Call for distribution dates.,,,,,,,,Vetted,
Blue Skies Winter Warm-Up Distribution Program,Blue Skies for Children,rec7sW8SKpiIGB0Pv,,"Provides children in need with a new or gently used coat, hat, gloves, scarf, hooded sweatshirt and/or blanket. The program is generally available in Fall each year. ",Blue Skies for Children,recpD00YzHSaqiVat,https://www.blueskiesforchildren.org/programs--applications.html,,(360) 756-6710,,"Children,Clothing,Teens","recH2S9jjAnFPldly, recL3UHuwxQb3U60a, rec3MOuAsiEAxOo3z",2505 Cedarwood Ave.,recyHeAnRpl2r4uwL,,"Call to set an appointment the last week of October, and an application will be mailed to you.​",,,,,,,,Vetted,
Foster Grads Program,Blue Skies for Children,rec7sW8SKpiIGB0Pv,,"A program that supports expenses related to helping foster youth graduate high school and/or enroll in higher education (dependent on funding availability). This program is open but not limited to those living in traditional foster homes, group homes, residential treatment centers, kinship care, independent living programs, and emergency placement centers. See application for eligible expenses.",Blue Skies for Children,recpD00YzHSaqiVat,https://www.blueskiesforchildren.org/programs--applications.html,,(360) 756-6710,,"Teens,Foster Youth,Adoption & Foster Care,Help Pay for School,Education","rec3MOuAsiEAxOo3z, reclH7DhBYv6jTEiY, rec3OblwwM1LIhz0a, rec9CBn7fr6g8Pg4c, recOGCSUVHnuizJWp",2505 Cedarwood Ave.,recPbef8R7bgCI321,,,,,,,,,,Vetted,
Blue Skies Driver's Education Scholarship   ,Blue Skies for Children,rec7sW8SKpiIGB0Pv,,"Scholarship offered to teens ages 15 to 17 who are homeless, low-income, or in foster care. It is a competitive scholarship that requires an application, essay, parent/guardian letter of reference, a third party letter of reference, school grades transcript, and access to a car and auto insurance. Typically, the scholarship grants up to $400 toward driver's education and is limited to a certain number of scholarships available each Spring and Fall. Award is based on both merit and need.​",,,https://www.blueskiesforchildren.org/programs--applications.html,,(360) 756-6710,,"Teens,Financial Assistance","rec3MOuAsiEAxOo3z, recbgFtOSl3oWCDSE",,recPiixkXiQ7Nokuw,,Visit https://www.blueskiesforchildren.org/programs--applications.html for application.,,,,,,,,Vetted,
Swim to Live Program,Blue Skies for Children,rec7sW8SKpiIGB0Pv,,"Originally established ​In memory of 19 year old Josh Fueston, this program supports children in need who love to swim and wish to participate on a swim team, take swim lessons, or need aquatic therapy.",Blue Skies for Children,recpD00YzHSaqiVat,https://www.blueskiesforchildren.org/programs--applications.html,,(360) 756-6710,,"Children,Financial Assistance,Recreation,Teens","recH2S9jjAnFPldly, recbgFtOSl3oWCDSE, recXSER99ndvVMgCn, rec3MOuAsiEAxOo3z",2505 Cedarwood Ave.,recYIg4K2N7jjYbzj,,Visit https://www.blueskiesforchildren.org/programs--applications.html for application.,,,,,,,,Vetted,
"The Evan J. Sobjack Memorial Fund, Legends of Mt. Baker ",Blue Skies for Children,rec7sW8SKpiIGB0Pv,,"In memory of Evan J. Sobjack, an avid snowboarder, this fund has been established to support children in need who are interested in learning to snowboard. A Little Wish request for snowboarding may include gear rental, a day pass to Mt. Baker, and/or ski bus fees. ",Blue Skies for Children,recpD00YzHSaqiVat,https://www.blueskiesforchildren.org/programs--applications.html,,(360) 756-6710,,"Children,Teens,Financial Assistance,Recreation","recH2S9jjAnFPldly, rec3MOuAsiEAxOo3z, recbgFtOSl3oWCDSE, recXSER99ndvVMgCn",2505 Cedarwood Ave.,recEStXVKErK65voe,,,,,,,,,,Vetted,
Parent Coalition,The Arc of Whatcom County,recgdgE4uVZ9DalkK,,"Families that need support with services and resources meet with a trained Parent Advocate to formulate a strategy to obtain services tailored to the needs of their family member. These needs may include special education services, future planning for adult services such as guardianship, government assistance such as Medicaid, or conflict resolution regarding standards of care.",The Arc of Whatcom County Dan Godwin Community Center,rec3Y8N3GL0vq1Xbk,https://arcwhatcom.org/wp/programs/parent-coalition/,parentcoalition@arcwhatcom.org,(360) 715-0170 ext. 303,,"Parents,Families,Guardianship,Parenting Education,Disability,Understand Disability,Navigating the System","rec4cE8qW6kVNk0bV, recOs8jW9d2WJDhsu, recztObrlCZ0KxoOp, recIYoQCXH2GX4meA, recLKLYZv41O8jPT4, recCxMWwGxYG6a0sF, recjW3uPkRdSkwZwb",2602 McLeod Rd.,rec0jKHecPZ6QQR2b,,,,,,,,,,Vetted,
Parent to Parent Support Programs,The Arc of Whatcom County,recgdgE4uVZ9DalkK,,"These programs provide emotional support and information to families of children with developmental disabilities, delays, and ongoing health care needs",The Arc of Whatcom County Dan Godwin Community Center,rec3Y8N3GL0vq1Xbk,https://arcwhatcom.org/wp/programs/parent-to-parent/,,"(360) 715-0170 ext. 302,(360) 715-0170 ext. 308 (Spanish)",,"Parents,Peer Support,Disability,Developmental Disability,Support Groups,One-on-One Support","rec4cE8qW6kVNk0bV, recAUFrYX3nmQ2p4Z, recLKLYZv41O8jPT4, recyhyWOEEXd1S4PP, recrHRnwl3cJ2GqbU, receszGz2p4iqVytY",2602 McLeod Rd.,reckelWWiNb23PCw7,,,,,,,,,,Vetted,
Self-Advocacy Program,The Arc of Whatcom County,recgdgE4uVZ9DalkK,,A program for young adults ages 16 to 30 with developmental disabilities. Self advocacy members are encouraged to develop and practice skills to become strong self-advocates.,The Arc of Whatcom County Dan Godwin Community Center,rec3Y8N3GL0vq1Xbk,https://arcwhatcom.org/wp/programs/self-advocacy/,selfadvocacy@arcwhatcom.org,(360) 715-0170,,"Disability,Developmental Disability,Support Groups,Teens,Adults","recLKLYZv41O8jPT4, recyhyWOEEXd1S4PP, recrHRnwl3cJ2GqbU, rec3MOuAsiEAxOo3z, recuFy3DUTNeadwWi",2602 McLeod Rd.,reck4hxVBp4gzdwuU,,,,,,,,,,Vetted,
Down Syndrome Outreach Program,The Arc of Whatcom County,recgdgE4uVZ9DalkK,,"Families needing information and education specifically related to Down syndrome are provided a trained Parent Advocate to address their needs. Families are also connected to other families to develop natural peer support through fun, family-friendly events throughout the year.",The Arc of Whatcom County Dan Godwin Community Center,rec3Y8N3GL0vq1Xbk,https://arcwhatcom.org/wp/programs/down-syndrome-outreach/,,(360) 715-0170 ext. 304,,"Disability,Developmental Disability,Understand Disability,Families","recLKLYZv41O8jPT4, recyhyWOEEXd1S4PP, recCxMWwGxYG6a0sF, recOs8jW9d2WJDhsu",2602 McLeod Rd.,recLoMDqchARs7VJq,,,,,,,,,,Vetted,
Medicaid Personal Care Parent Training,The Arc of Whatcom County,recgdgE4uVZ9DalkK,,Six hours of continuing education are needed to fulfill parental obligations in receiving Medicaid Personal Care funding to care for their family member. Twice a year the Parent Coalition Program conducts trainings tailored to meet the needs of these families. Email admin@arcwhatcom.org for more information.,The Arc of Whatcom County Dan Godwin Community Center,rec3Y8N3GL0vq1Xbk,http://arcwhatcom.org/wp/programs/,admin@arcwhatcom.org,(360) 715-0170,,"Care,Caregivers,Parents,Families,Disability","recFynVbJhP9DcOwP, recab31YbKgpoKdCp, rec4cE8qW6kVNk0bV, recOs8jW9d2WJDhsu, recLKLYZv41O8jPT4",2602 McLeod Rd.,recLXASC6UpckVMcN,,,,,,,,,,Vetted,
The Arc Legislative Advocacy,The Arc of Whatcom County,recgdgE4uVZ9DalkK,,"In an effort to ensure that the needs of persons with developmental disabilities are met with appropriate health and social services, various opportunities exist. The Local Leadership program offers families a chance to learn how to be effective advocates. Families are encouraged to participate in grass roots advocacy by writing their legislators, participating in seminars, telling their stories to their legislators at the Fall Legislative Coffee, and obtaining updated information through the e-Alert list year-round and during the legislative season.",The Arc of Whatcom County Dan Godwin Community Center,rec3Y8N3GL0vq1Xbk,https://arcwhatcom.org/wp/programs/legislative-advocacy/,,(360) 715-0170,,"Disability,Developmental Disability,Families","recLKLYZv41O8jPT4, recyhyWOEEXd1S4PP, recOs8jW9d2WJDhsu",2602 McLeod Rd.,recqzOuVCAxuxHNLl,,,,,,,,,,Vetted,
Early Support for Infants and Toddlers (WCEL),Whatcom Center for Early Learning,recZR9OfxDfayGV8M,ESIT,Serves families with children from birth to three years old who have developmental delays or disabilities in order to maximize each child’s development.,Whatcom Center for Early Learning,rec2oFnO3LN1mI5sv,https://www.wcel.net/early-intervention,,(360) 715-7485,,"Early Childhood Intervention,Children,Families,Disability,Developmental Disability","recoILBn6aJRJVOJz, recH2S9jjAnFPldly, recOs8jW9d2WJDhsu, recLKLYZv41O8jPT4, recyhyWOEEXd1S4PP",2001 H St.,recfqzjPPAYPKBEeK,,,,,,,,,,Vetted,
Sensational Toddlers,Whatcom Center for Early Learning,recZR9OfxDfayGV8M,,"A parent-child program for children ages 18 months to 3 years, with and without special needs. Check the website for registration openings.",Whatcom Center for Early Learning,rec2oFnO3LN1mI5sv,https://www.wcel.net/playgroup-classes,,(360) 671-3660,,"Families,Children,Parents","recOs8jW9d2WJDhsu, recH2S9jjAnFPldly, rec4cE8qW6kVNk0bV",2001 H St.,recQfEAbROvOLL6OV,,,,,,,,,,Vetted,
WCEL Friends Playgroup,Whatcom Center for Early Learning,recZR9OfxDfayGV8M,,A parent-child program for children ages 18 months to 3 years who are receiving Early Intervention Services at Whatcom Center for Early Learning. These playgroups provide socialization and play opportunities for children and their caregivers.,Whatcom Center for Early Learning,rec2oFnO3LN1mI5sv,https://www.wcel.net/playgroup-classes,,(360) 671-3660,,"Children,Families,Early Childhood Intervention,Parents","recH2S9jjAnFPldly, recOs8jW9d2WJDhsu, recoILBn6aJRJVOJz, rec4cE8qW6kVNk0bV",2001 H St.,rec8XkFW1fAWlRUHj,,,,,,,,,,Vetted,
WCEL Drop-in Playgroups,Whatcom Center for Early Learning,recZR9OfxDfayGV8M,,"WCEL offers two drop-in playgroups: Ferndale Toddler Time and Bellingham Toddler Time. These groups let children and their families meet other families to socialize, play, and learn together.",Whatcom Center for Early Learning,rec2oFnO3LN1mI5sv,https://www.wcel.net/playgroup-classes,,(360) 671-3660,,"Children,Families","recH2S9jjAnFPldly, recOs8jW9d2WJDhsu",2001 H St.,recT9ihPj4yjEh6YC,,,,,,,,,,Vetted,
Nurse-Family Partnership,Whatcom County Health Department ,recsJOY2XgLE7ar6o,,"A proven method of support for first-time moms. Through NFP, moms and their families get regular home visits from a nurse until the first child is two years old. Families and children who are part of the program are more likely to have healthy pregnancy outcomes, healthy child development, and economic self-sufficiency. First time low-income moms in Whatcom County can enroll in the program prior to their 28th week of pregnancy.",Whatcom County Health Department - State Street,recYvoWMV4zK72ick,https://www.whatcomcounty.us/1570/Nurse-Family-Partnership-NFP,,(360) 778-6100,,"Mothers,Families,Pregnant,Home Visiting,Early Childhood Intervention,Maternity Care,Health,Postnatal Care,Family Planning","recNnik9CH6wd1RHx, recOs8jW9d2WJDhsu, receH7Eb28JwIIF3S, recJjmOFKPrK8f2uK, recoILBn6aJRJVOJz, receACWnJE9wFfvXS, reciYkvwqodZbQOxg, recxsJXbaWBSYkQIA, rec8YBzBBxAKdywsn",1500 N State St.,rectOFcdCMsUeuVaf,,"Download a referral form online, or call for more information about enrollment. ",,,,,,,,Vetted,
Whatcom County Veterans Program,Whatcom County Health Department ,recsJOY2XgLE7ar6o,,"A point of entry to local, state and federal benefits and services for veterans. Services include burial assistance, compensation and pension assistance, employment assistance, health services, housing assistance, legal assistance, social service programs, temporary financial assistance, and transportation.",Whatcom County Health Department ,receYX7V2zWpvn7tU,https://www.whatcomcounty.us/866/Veterans-Program,,(360) 778-6050,,"Veterans,Financial Assistance,Work,Employment,Housing,Legal,Navigating the System,Health,Emergency Payments,Government Benefits,Transportation,Burial & Funeral Help,Armed Forces,Active Duty,National Guard","rec15zX42PsepACwI, recbgFtOSl3oWCDSE, recgLX6b1UIeYq0PK, recTUeifU3gicG2BD, recCKTPd4gJzUTY28, rec7zSrfhPad6ViS5, recjW3uPkRdSkwZwb, reciYkvwqodZbQOxg, recZC2bATGtKSdzXU, recIiMl04p86EPI38, recLxdzEmSGBRoFid, rec9Z7Po9PQ03NjGT, recNEORrIacVlNquq, recoI3ykBdfAFEw1U, rec9ajIPZwYlhXKU1",509 Girard St.,recFkhdookFG38kns,,"To meet with Whatcom County Veteran Program staff, please call to schedule an appointment. There are currently no walk-in hours available.",,,,,,"recXX5JQd89UYAx4b,reczcNYus1EMrfU6g",,Vetted,
Answers Counseling Services,Answers Counseling,rec3Z3GXx1xLDP8zz,,Individual and family counseling services.,,,https://www.answerscounseling.org/counseling,,(360) 255-7855,,"Counseling,Family Counseling,Individual Counseling,Mental Health Care,Health","recmcWSEr2iFwDaTL, recoLdYggUaCc73jH, receBBmmUm0PJgBIF, recpSmwmXlthgV7gO, reciYkvwqodZbQOxg",,recABisNzFUZ4DH7X,,,,,,,,,,Vetted,
Infant Case Management,Answers Counseling,rec3Z3GXx1xLDP8zz,,"The purpose of Infant Case Management (ICM) is to improve the welfare of infants by providing their parents with information and assistance to access medical, social, educational, and environmental services. Families that meet criteria for ICM will be offered services focused on referrals and linkage to community resources.",,,https://www.answerscounseling.org/infant-case-management,,(360) 255-7855,,"Care,Case Management,Navigating the System,Families,Parents,Early Childhood Intervention,Pregnant","recFynVbJhP9DcOwP, recPJvpaJHs1EMUXw, recjW3uPkRdSkwZwb, recOs8jW9d2WJDhsu, rec4cE8qW6kVNk0bV, recoILBn6aJRJVOJz, receH7Eb28JwIIF3S",,recxIDwSrVFDV0fdK,,,,,,,,,,Vetted,
Answers Counseling Maternity Support Services,Answers Counseling,rec3Z3GXx1xLDP8zz,,"This program is designed to help people who are pregnant receive the medical and social services they request and need. If you are pregnant and covered under Medicaid, you are eligible for services. A Registered Nurse, Nutritionist, Behavioral Health Specialist, and Community Health Worker (Resource Case Manager) will guide and support during your pregnancy through two month's postpartum.",,,https://www.answerscounseling.org/maternity-support-services,,(360) 255-7855,,"Maternity Care,Health,Pregnant,Postnatal Care,Mothers,Counseling,Health Education,Nutrition,Nutrition Education,Mental Health Care,Navigating the System,Case Management","receACWnJE9wFfvXS, reciYkvwqodZbQOxg, receH7Eb28JwIIF3S, recxsJXbaWBSYkQIA, recNnik9CH6wd1RHx, recmcWSEr2iFwDaTL, reck5XAwtGi6t3XeG, recsjz9aCm9eI3HvD, recxKh3xVgHqKNd5W, recpSmwmXlthgV7gO, recjW3uPkRdSkwZwb, recPJvpaJHs1EMUXw",,recprE2b2TRl757WE,,,,,,,,,,Vetted,
Answers Counseling Parenting Programs,Answers Counseling,rec3Z3GXx1xLDP8zz,,Individualized plans to fit each parent's needs.,,,https://www.answerscounseling.org/promoting-first-relationships,,(360) 255-7855,,"Parenting Education,Parents,Families","recIYoQCXH2GX4meA, rec4cE8qW6kVNk0bV, recOs8jW9d2WJDhsu",,recPMpYgHlZ9rklZ6,,,,,,,,,,Vetted,
Prevention Coalitions,Whatcom County Health Department ,recsJOY2XgLE7ar6o,,"The Whatcom County Health Department partners with community organizations and all seven Whatcom County school districts to coordinate and support prevention coalitions and community groups. These coalitions work with schools and others to increase connections and support healthy youth and families. Visit the website to learn more and get involved.

",,,https://whatcomcounty.us/3201/Prevention-Coalitions,,,,"Health,Families,Parents,Support Network","reciYkvwqodZbQOxg, recOs8jW9d2WJDhsu, rec4cE8qW6kVNk0bV, reczPHnbc0WTe8J74",,recSnK2n1dcqjJGqj,,,,,,,,,,Vetted,
Syringe Services Program,Whatcom County Health Department ,recsJOY2XgLE7ar6o,,"Diseases like HIV or hepatitis C can be spread when people who use injection drugs share needles or other equipment. Whatcom County Health Department's syringe clinics provide new, sterile needles and equipment to people who use injection drugs and provide connections to drug treatment, disease testing, vaccines, and other social services.",Whatcom County Health Department - State Street,recYvoWMV4zK72ick,https://www.whatcomcounty.us/3252/Syringe-Services-Program,,(360) 778-6100,,"Substance Dependency,Prevent & Treat,Health","recU6IywQcWaehPgJ, recKS0XVAOeMrFEMb, reciYkvwqodZbQOxg",1500 N State St.,recppZxbCHF4LlOUR,,,,,,,,"recDMPZrQYnHBpU6i,recW6B6CKg7Qg3xYW",,Vetted,
Arne Hanna Aquatic Center,Bellingham Parks and Recreation,recPSK8F1783zlqzD,,"Offerings include lap swims, American Red Cross swim lessons and training courses, shallow water aerobics, deep water running, as well as preschool swims and open swims for people to play and enjoy the facility.

",Arne Hanna Aquatic Center,recEUzbjFAt8GbyJf,https://cob.org/services/recreation/aquatic,aquatics@cob.org,(360) 778-7665,,"Recreation,Families,Children,Teens,Adults,Seniors","recXSER99ndvVMgCn, recOs8jW9d2WJDhsu, recH2S9jjAnFPldly, rec3MOuAsiEAxOo3z, recuFy3DUTNeadwWi, recJnEdhIA6wUbdzg",1114 Potter Ave.,recRiBDECdKnWV8TO,,,,,"Day passes, 10 visit passes, 3 month passes, and annual passes available.",,,"recna416lxzekZKnE,recWJK0Qs7lM5x5lE",,Vetted,
Free Shower Program,Bellingham Parks and Recreation,recPSK8F1783zlqzD,,Free showers are available for anyone in need at Arne Hanna Aquatic Center during regular pool hours.,Arne Hanna Aquatic Center,recEUzbjFAt8GbyJf,https://cob.org/services/recreation/aquatic,aquatics@cob.org,(360) 778-7665,,"Personal Hygiene,Homeless,Adults,Families,Seniors","recIT2NHumbVjnYj3, rec7wvcVfmMf7RwS7, recuFy3DUTNeadwWi, recOs8jW9d2WJDhsu, recJnEdhIA6wUbdzg",1114 Potter Ave.,recHCNSE21sbBALWw,,,,,,,,"recWJK0Qs7lM5x5lE,recna416lxzekZKnE",,Vetted,
Bellingham Playbook,Bellingham Parks and Recreation,recPSK8F1783zlqzD,,Your guide to recreation and educational opportunities in Bellingham. The new Playbook (formerly known as the Leisure guide) provides a complete listing of recreation activities available throughout Bellingham. ,Bellingham Parks and Recreation,recHfAgtO79fqJFZT,https://cob.org/services/recreation/activities/playbook,,,,"Recreation,Families,Children,Teens","recXSER99ndvVMgCn, recOs8jW9d2WJDhsu, recH2S9jjAnFPldly, rec3MOuAsiEAxOo3z",210 Lottie St.,rec3DH4OZoMcFeMFC,,,,,,,,,,Vetted,
City of Bellingham Community Garden Program,Bellingham Parks and Recreation,recPSK8F1783zlqzD,,Program participants can take advantage of 200 square feet of garden space to grow their own food and flowers. Registration for new gardeners begins in January each year on a first-come-first-served basis.  Returning gardeners who want the same plots are given priority to register for their same plots starting in November for the following year.   ,"Fairhaven Community Garden,Sven Hoyt Community Garden,Lakeway Community Garden","rec6kGe8tITFNUd2s, recUyouo9eY8UNZBC, recJAX81rsyysili1",https://cob.org/services/recreation/activities/gardens,parks@cob.org,(360) 778-7000,,Community Gardens,recfiKWaizoHZtPlF,"10th St. and Wilson Ave.,32nd St. between Taylor Ave. and Donovan Ave.,Lakeway Dr. and Woburn St.",recHE1hsxQpgYNUdh,,,,,Fee per plot per calendar year. Scholarships available.,,,,,Vetted,
Tech Help at BPL,Bellingham Public Library,recMldsZhSR1yrGqR,,"Need help with technology questions or with using the Library’s electronic resources? BPL can help you by phone, by email, in person, or with one-on-one assistance during a Tech Basics Coaching session. Coaching sessions take place every Wednesday afternoon at the Central Library. Check the event calendar for upcoming sessions, and call to register.",Bellingham Public Library Central Branch,rec5f7nhKCUfzZqJU,https://www.bellinghampubliclibrary.org/using-the-library/tech-help,https://www.bellinghampubliclibrary.org/ask/ask-us-form,(360) 778-7323,,"Computer Class,Computer or Internet Access,More Education,Community Support Services","recxXf02BG8n1DE35, recWlYhypSgHFFWRW, recxkS1dX1ZBiHPth, recwQuL3cKTIDX0Ib",210 Central Ave.,recm30wvLLz5KhCOc,,,,,,,,,,Vetted,
