name,organizations,organization_id,alternate_name,description,locations,location_id,url,email,phones,contacts,taxonomy,taxonomy_term_id,address,id,status,application_process,interpretation_services,wait_time,fees,accreditations,licenses,schedule,x-details,y-org status,programs
Early Head Start,Opportunity Council,recDx6bdruXoWzLPy,,"A special Head Start program serving infants, toddlers, and pregnant parents in Whatcom County. Services include prenatal education, health and nutrition services, family development support, and home visits focusing on child development and quality early education. This program is for income eligible families.",Opportunity Council Early Learning and Family Services,recr9zO51MLCurR5R,https://www.oppco.org/basic-needs/infants-toddlers/,,(360) 734-8396,,"Head Start,Education,Families,Children,Early Childhood Intervention,Parenting Education,Parents","recTcZuOrFxTGOCTs, recOGCSUVHnuizJWp, recOs8jW9d2WJDhsu, recH2S9jjAnFPldly, recoILBn6aJRJVOJz, recIYoQCXH2GX4meA, rec4cE8qW6kVNk0bV",1111 Cornwall Ave,recCiTWs5rXdzYEO8,,"Selection process begins in early summer and continues until classes are full. Apply online, or pick up an application in person.",,,,,,,,Vetted,
Head Start,Opportunity Council,recDx6bdruXoWzLPy,,"With no cost for families that qualify, Opportunity Council offers preschool services throughout Whatcom County for children between the ages of 3 and 5.",Opportunity Council Early Learning and Family Services,recr9zO51MLCurR5R,https://www.oppco.org/basic-needs/preschool-education/,,(360) 734-8396,,"Head Start,Preschool,Education,Children,Families","recTcZuOrFxTGOCTs, recGS0bYbwxsgLeKd, recOGCSUVHnuizJWp, recH2S9jjAnFPldly, recOs8jW9d2WJDhsu",1111 Cornwall Ave,recrD7Y4506oaNPqB,,"Apply online, or request an application in person. You can apply any time of the year. While the majority of children begin at the start of the traditional school year, whenever vacancies are available they are filled by families that have completed the eligibility process.",,,,,,,,Vetted,
Child Care Aware of NW Washington,Opportunity Council,recDx6bdruXoWzLPy,,"Provides families with information and referrals to licensed child care facilities and supports child care providers through coaching, technical assistance, behavioral consultation, and professional development opportunities.",Opportunity Council Early Learning and Family Services,recr9zO51MLCurR5R,https://www.oppco.org/basic-needs/child-care-resources/,,1-800-446-1114,,"Childcare,Children,Help Find Childcare,Daytime Care","recNHN96Flxd18XRt, recH2S9jjAnFPldly, recqZnWdkZeo2DENj, recITCMLWdpvz84Xc",1111 Cornwall Ave,recdwiBfwj4N45Vj0,,,,,,,,,,Vetted,
Single Entry Access to Services,Opportunity Council,recDx6bdruXoWzLPy,SEAS,"Housed at the Opportunity Council, this program of Whatcom Taking Action provides resources and support for families and medical professionals looking for services for children birth to 21 in Whatcom County with known or suspected special health care needs.",Opportunity Council Early Learning and Family Services,recr9zO51MLCurR5R,https://whatcomtakingaction.org,,(360) 715-7485,,"Children,Disability,Developmental Disability,Navigating the System,Health","recH2S9jjAnFPldly, recLKLYZv41O8jPT4, recyhyWOEEXd1S4PP, recjW3uPkRdSkwZwb, reciYkvwqodZbQOxg",1111 Cornwall Ave,recjJSMGLXf7pskpq,,,,,,,,,,Vetted,
Early Support for Infants and Toddlers (Opportunity Council),Opportunity Council,recDx6bdruXoWzLPy,ESIT,Serves families with children from birth to three years old who have developmental delays or disabilities in order to maximize each child’s development.,Opportunity Council Early Learning and Family Services,recr9zO51MLCurR5R,https://www.oppco.org/basic-needs/infants-toddlers/,,(360) 715-7485,,"Early Childhood Intervention,Children,Families,Disability,Developmental Disability","recoILBn6aJRJVOJz, recH2S9jjAnFPldly, recOs8jW9d2WJDhsu, recLKLYZv41O8jPT4, recyhyWOEEXd1S4PP",1111 Cornwall Ave,rec2JX5keEvajZwaS,,,,,,,,,,Vetted,
Child Care Nutrition Program,Opportunity Council,recDx6bdruXoWzLPy,,Reimburses licensed/participating family child care providers for the nutritious meals they serve to the children in their care.,Opportunity Council Early Learning and Family Services,recr9zO51MLCurR5R,https://www.oppco.org/basic-needs/child-care-resources/,,(360) 734-8396 ext. 1426,,Nutrition,recsjz9aCm9eI3HvD,1111 Cornwall Ave,recaYPPrUyLqlssAM,,,,,,,,,,Vetted,
Emergency Child Care Voucher,Opportunity Council,recDx6bdruXoWzLPy,,Provides short-term emergency assistance to help families pay for high-quality child care in a licensed child care center or licensed family home.,Opportunity Council Early Learning and Family Services,recr9zO51MLCurR5R,https://www.ccanorthwest.org/assistance/,,(360) 734-8396 ext. 1227,,"Childcare,Help Pay for Childcare,Children,Families","recNHN96Flxd18XRt, recW6p3Z19RNemT4K, recH2S9jjAnFPldly, recOs8jW9d2WJDhsu",1111 Cornwall Ave,recVUWypipwF8GsoU,,,,,,,,,,Vetted,
Kinship Care,Opportunity Council,recDx6bdruXoWzLPy,,"Offers support services for grandparents or other non-parental caregivers of children in their custody in Whatcom, Island and San Juan County.",Opportunity Council Community Resource Center,recTrJGLa6PeBNJOh,https://www.oppco.org/basic-needs/,,(360) 734-5121 ext. 1455,,"Adoption & Foster Care,Adoption & Foster Parenting,Post-Adoption Support,Families,Guardianship","rec3OblwwM1LIhz0a, recj5Q4dhvmHnzEbF, receCFKXkaUtNuNLc, recOs8jW9d2WJDhsu, recsBi3BSRulWAewJ",1111 Cornwall Ave.,rec3Mxgz3o6eg79Uk,,,,,,,,,,Vetted,
Opportunity Council Community Resource Center,Opportunity Council,recDx6bdruXoWzLPy,CRC,"Connects people with community resources to help meet basic needs such as food and housing, including referrals for housing and rental assistance.",Opportunity Council Community Resource Center,recTrJGLa6PeBNJOh,https://www.oppco.org/basic-needs/,,(360) 734-5121 option 3,,"Community Support Services,Navigating the System,Housing,Help Find Housing,Homeless,Near Homeless,Food Benefits,Government Food Benefits","recwQuL3cKTIDX0Ib, recjW3uPkRdSkwZwb, recCKTPd4gJzUTY28, recb6fXM65HersYLt, rec7wvcVfmMf7RwS7, rec2cxjnl0Pw6JmTi, recLDXNT9zWcqPFj1, recqJMdurXascAmeG",1111 Cornwall Ave.,recXb1NEhx3Qe9Vsh,,,,,,,,recXpOVvgTqk3dTdE,,Vetted,
East Whatcom Regional Resource Center,Opportunity Council,recDx6bdruXoWzLPy,EWRRC,"Provides general information and resources for the Maple Falls community. Resources include computer and phone access, notary, hygiene and health supplies, clothes, books, toys, household items, specialized intake support such as SNAP benefits, and more.",East Whatcom Regional Resource Center,rec3XVu5BUJq31pR7,https://www.oppco.org/ewrrc/,,(360) 599-3944,,"Community Support Services,Navigating the System,Food Benefits,Government Food Benefits,Goods,Home Goods,Clothing,Toys & Gifts,Books,Personal Care Items,Computer or Internet Access,Notary","recwQuL3cKTIDX0Ib, recjW3uPkRdSkwZwb, recLDXNT9zWcqPFj1, recqJMdurXascAmeG, recYkNaWD02ZhnpEv, recpXP4yQXZj1q6Sr, recL3UHuwxQb3U60a, rec7gQR1YEUvAme3l, rec54dNKKPSAVE2Q2, rece3S4OpuUrKdj0j, recWlYhypSgHFFWRW, recAEElnvdFFqTrmA",8251 Kendall Rd.,reczhHHeqzh0vEIPJ,,,,,,,,"reco0npaEa6LE40dY,rect8OVobB6ib9h7t,reckCVd7xnm1P6nKU",,Vetted,
Basic Food Outreach,Opportunity Council,recDx6bdruXoWzLPy,,Provides information and direct application support that can help families and individuals obtain food stamps.,Opportunity Council Community Resource Center,recTrJGLa6PeBNJOh,https://www.whatcomabc.org/quality-of-life/food-access/basic-food-snap/,,(360) 734-5121 option 3,,"Food,Food Benefits,Government Food Benefits","rec6msXLncJckr8ek, recLDXNT9zWcqPFj1, recqJMdurXascAmeG",1111 Cornwall Ave.,recaQZTZfOfLMhDHm,,,,,,,,,,Vetted,
Opportunity Council Homeless Housing Programs,Opportunity Council,recDx6bdruXoWzLPy,,"Housing programs for individuals and families experiencing unsheltered homelessness, including short-term and permanent housing options. Apply through the Community Resource Center.",Opportunity Council Community Resource Center,recTrJGLa6PeBNJOh,https://www.oppco.org/basic-needs/housing/,,(360) 734-5121 option 3,,"Homeless,Housing,Help Find Housing,Long-Term Housing,Short-Term Housing","rec7wvcVfmMf7RwS7, recCKTPd4gJzUTY28, recb6fXM65HersYLt, reci7zq6u0lYhE1TQ, recnW3sU3JCGbGLxd",1111 Cornwall Ave.,recdeUXIxvbwZWAkk,,,,,,,,recXpOVvgTqk3dTdE,,Vetted,
Whatcom Homeless Service Center,Opportunity Council,recDx6bdruXoWzLPy,WHSC,Provides referrals to housing services to prevent and end homelessness. Apply through the Community Resource Center. ,Whatcom Homeless Service Center,recFRA3kSat2EWTTx,https://www.oppco.org/whsc/,,(360) 255-2091 ext. 1137,,"Housing,Homeless,Long-Term Housing,Short-Term Housing,Housing Vouchers","recCKTPd4gJzUTY28, rec7wvcVfmMf7RwS7, reci7zq6u0lYhE1TQ, recnW3sU3JCGbGLxd, recdpXtZju5oBVh1a",1111 Cornwall Ave.,recB9YdPIbozfLOlF,,,,,,,,,,Vetted,
Rental Assistance (Opportunity Council),Opportunity Council,recDx6bdruXoWzLPy,,"Opportunity Council administers the Federal Emergency Rental Assistance program for residents in Whatcom, Island, and San Juan Counties. Apply online at oppco.org/help-with-rent",,,https://www.oppco.org/basic-needs/housing/help-with-rent/,,(360) 734-5121 ext. 1030,,"Home Renters,Help Pay for Housing,Housing","recCYaVT8Ev1CcuKZ, recJYGDCounIMHC0T, recCKTPd4gJzUTY28",,recztxU567XMc3fHu,,,,,,,,,,Vetted,
Basic Food Employment and Training Program (Opportunity Council),Opportunity Council,recDx6bdruXoWzLPy,BFET,"Assists federally funded Basic Food (SNAP) participants gain skills, training or work experience to increase their ability to attain a living wage career. ",,,https://www.oppco.org/basic-needs/job-skills-money-management/,,(360) 734-5121 ext. 1223,,"Work,Help Find Work,Clothes for Work,Supplies for Work,Help Pay for Work Expenses","recgLX6b1UIeYq0PK, recD0R7SNBKL1THVr, recYSq8M8y6BHebhe, recJJCZYcmYQHquB6, rec2BLcRDmerXYd4W",,recus6eyLnfpIoBWd,,,,,,,,,,Vetted,
Foundational Community Support Employment Program ,Opportunity Council,recDx6bdruXoWzLPy,FCS,Offers services to job seekers who are on Medicaid. ,,,https://www.oppco.org/basic-needs/job-skills-money-management/,,(360) 734-5121 ext. 1223,,"Work,Help Find Work,Clothes for Work,Supplies for Work,Help Pay for Work Expenses","recgLX6b1UIeYq0PK, recD0R7SNBKL1THVr, recYSq8M8y6BHebhe, recJJCZYcmYQHquB6, rec2BLcRDmerXYd4W",,recuJvepOrmjggg7Z,,,,,,,,,,Vetted,
Financial Literacy and Renters Education,Opportunity Council,recDx6bdruXoWzLPy,FLARE,"A free series of classes designed to increase knowledge and skills in budgeting, credit, debt, landlord/tenant law and savings.",,,https://www.oppco.org/basic-needs/job-skills-money-management/,,(360) 734-5121 ext. 1223,,"Financial Education,Home Renters,Housing Advice,Credit Counseling","recPJzsKXTsP7BWvR, recCYaVT8Ev1CcuKZ, rechFAxtvrNqrnrWc, rec5Q8TGXK5hy3COr",,recbhbljZewTjdDUH,,,,,,,,,,Vetted,
On the Money,Opportunity Council,recDx6bdruXoWzLPy,,"Independent classes focusing on increasing knowledge of credit, debt management, savings strategies, asset building, tax information and more.",,,https://www.oppco.org/basic-needs/job-skills-money-management/,,(360) 734-5121 ext. 1223,,"Financial Education,Credit Counseling","recPJzsKXTsP7BWvR, rec5Q8TGXK5hy3COr",,recyDbQzLJ1ZAalrF,,,,,,,,,,Vetted,
Energy Assistance (Opportunity Council),Opportunity Council,recDx6bdruXoWzLPy,,"Bill assistance for home heating and energy bills. Households must be income eligible to receive assistance.  Depending on the time of year, help may be available for electricity, natural gas, propane, heating oil, and wood bills.",Opportunity Council Community Resource Center,recTrJGLa6PeBNJOh,https://www.oppco.org/basic-needs/home-energy/,,(360) 255-2192,,Help Pay for Utilities,recqJeWfuWoaymxab,1111 Cornwall Ave.,recCISeJ3E2YM3q3G,,"Apply online at https://tinyurl.com/y5ljqf5a, or by phone.",,,,,,,,Vetted,
Weatherization Program,Opportunity Council,recDx6bdruXoWzLPy,,"Improves a home’s energy efficiency, durability, indoor air quality and addresses health and safety concerns.  Weatherization services focus on attic, floor and wall insulation, reducing drafts, heating system cleaning and safety inspection and ventilation improvements. Available for both homeowners and renters with landlord permission. ",,,https://www.oppco.org/basic-needs/home-energy/,,(360) 734-5121 ext. 1020,,"Home Owners,Efficient Appliances,Health & Safety,Maintenance & Repairs","recEHD8HrY0RkA18P, reck9wKsIibB795yA, recLpmynC0bhqHBbr, rechdBo0CxxYWlvv2",,recM9kHIEWcGOOtmh,,,,,,,,,,Vetted,
Weatherization Plus Health Program,Opportunity Council,recDx6bdruXoWzLPy,,"Identifies indoor air quality improvements for a home, including mold and moisture reduction, pest mitigation and air quality improvements that can  help reduce asthma triggers and improve indoor environments. Available for both homeowners and renters with landlords permission. ",,,https://www.oppco.org/basic-needs/home-energy/,,(360) 734-5121 ext. 1020,,"Home Owners,Home Renters,Health & Safety,Maintenance & Repairs,Pest Control","recEHD8HrY0RkA18P, recCYaVT8Ev1CcuKZ, recLpmynC0bhqHBbr, rechdBo0CxxYWlvv2, recN2SwhQY1GC6MSP",,recwfoqDBbylxuT9A,,,,,,,,,,Vetted,
Home Repair Loan,Opportunity Council,recDx6bdruXoWzLPy,,"Deferred, low-interest loans may be provided to income-qualifying homeowners to address repairs that focus on: home foundation repair or installation, roof repair or replacement, plumbing, electrical, septic siding, floor, gutters or other repairs to help meet safety standards. ",,,https://www.oppco.org/basic-needs/home-energy/,,(360) 734-5121 ext. 1020,,"Home Owners,Maintenance & Repairs","recEHD8HrY0RkA18P, rechdBo0CxxYWlvv2",,recUYtnJTb0xvOiPp,,,,,,,,,,Vetted,
City of Bellingham Mobile Home Repair,Opportunity Council,recDx6bdruXoWzLPy,Mobile Home Repair,"Assists Bellingham homeowners with limited repairs that can address health and safety, durability issues, and energy efficiency measures. ",,,https://www.oppco.org/basic-needs/home-energy/,,(360) 734-5121 ext. 1020,,"Maintenance & Repairs,Health & Safety,Efficiency Upgrades","rechdBo0CxxYWlvv2, recLpmynC0bhqHBbr, recviNaQYEPkTTrTM",,recxFYCvQ1Dt1ES2w,,,,,,,,,,Vetted,
Conservation Education,Opportunity Council,recDx6bdruXoWzLPy,,"Provides both in-home energy assessments and classroom-based workshops to identify ways to save on energy bills, conserve energy and water, improve health and safety in homes. This services is no cost to eligible households.",,,https://www.oppco.org/basic-needs/home-energy/,,(360) 734-5121 ext. 1020,,,,,recpQBfKoNPSIFrzE,,,,,,,,,,Vetted,
Homeless Outreach Team,Opportunity Council,recDx6bdruXoWzLPy,HOT,"Connects people experiencing homelessness with services, and supports community members in working through issues surrounding homelessness.",,,https://www.oppco.org/whsc/,,(360) 312-3717,,"Homeless,Housing,Navigating the System,Community Support Services","rec7wvcVfmMf7RwS7, recCKTPd4gJzUTY28, recjW3uPkRdSkwZwb, recwQuL3cKTIDX0Ib",,recE3MGNwINs0Yszg,,,,,,,,,,Vetted,
Supportive Services for Veteran Families,Opportunity Council,recDx6bdruXoWzLPy,SSVF,"Provides housing and support services to those who have served in active military, naval or air service, and their families. The program aims to serve those who are at risk of homelessness or who are homeless.",Opportunity Council Community Resource Center,recTrJGLa6PeBNJOh,https://www.oppco.org/basic-needs/housing/,,(360) 734-5121 option 3,,"Housing,Homeless,Near Homeless,Veterans","recCKTPd4gJzUTY28, rec7wvcVfmMf7RwS7, rec2cxjnl0Pw6JmTi, rec15zX42PsepACwI",1111 Cornwall Ave.,recJaQJrJCKLDw4m1,,Contact the Community Resource Center for screening.,,,,,,,,Vetted,
Whatcom Volunteer Center,Opportunity Council,recDx6bdruXoWzLPy,,"Transforms people and neighborhoods by providing a means for volunteers, nonprofits, schools, government and health care organizations to come together to solve community challenges.",Opportunity Council Administration Building,recN8rppdFwWOCGGn,https://www.whatcomvolunteer.org,,(360) 734-3055,,,,1419 Cornwall Ave.,recoiyyynahtkwbAa,,,,,,,,,,Vetted,
Needs Based Ferry Passes,Opportunity Council,recDx6bdruXoWzLPy,,Discounted ferry tickets for eligible Lummi Island residents. Call for an appointment.,Opportunity Council Community Resource Center,recTrJGLa6PeBNJOh,https://www.oppco.org/basic-needs/,,(360) 734-5121 option 3,,"Transit,Transportation,Help Pay for Transit","recDAUBObMv6C8sEk, recLxdzEmSGBRoFid, recsuoQKj9GsVXX0B",1111 Cornwall Ave.,rec92qGXi2EpoDOqn,,,,,,,,,,Vetted,
WTA Bus Passes (Opportunity Council),Opportunity Council,recDx6bdruXoWzLPy,,"Free WTA 6-ride passes are available each Friday, 8:00 AM - 9:00 AM. Limit 2 per person per month. A limited supply is also available at East Whatcom Regional Resource Center. ","Opportunity Council Community Resource Center,East Whatcom Regional Resource Center","recTrJGLa6PeBNJOh, rec3XVu5BUJq31pR7",https://www.oppco.org/basic-needs/,,(360) 734-5121 option 3,,"Transit,Transportation,Help Pay for Transit,Bus Passes","recDAUBObMv6C8sEk, recLxdzEmSGBRoFid, recsuoQKj9GsVXX0B, recOVdeeFN71Hnxps","1111 Cornwall Ave.,8251 Kendall Rd.",recDWFJ5m38nsln87,,,,,,,,,,Vetted,
Maple Alley Inn,Opportunity Council,recDx6bdruXoWzLPy,,"Prepares and serves hot, home cooked meals for the community. Currently providing hot to-go meals every Wednesday, 12 - 1pm at Faith Lutheran Church.","Faith Lutheran Church,St Paul’s Episcopal Old Parish Hall","recXgbHyxorTa9FPY, recLuBamaRIf03Pka",,,,,"Food,Free Meals,Meals","rec6msXLncJckr8ek, recQIjrVP43MjBU7T, recfk98nkziKgILB0","2750 McLeod Rd,2117 Walnut St.",recqfK6GGfZdeH5eQ,,,,,,,,recO2O2ZfsFUMx6Ca,,Vetted,
Basic Food,DSHS (Washington State Department of Social and Health Services),recgasOSzMjIX2vGR,SNAP,"The Supplemental Nutrition Assistance Program, or SNAP, called Basic Food in Washington, helps people with low incomes make ends meet by providing monthly benefits to buy food. Apply online at washingtonconnection.org, by phone, or at your local Community Services Office. ",Bellingham Community Services Office (DSHS),rectPhCnrZMP8Rl6q,https://www.dshs.wa.gov/esa/community-services-offices/basic-food,,(877) 501-2233,,"Food,Food Benefits,Government Food Benefits,Help Pay for Food","rec6msXLncJckr8ek, recLDXNT9zWcqPFj1, recqJMdurXascAmeG, reclNA3Wwp1htS782",4101 Meridian St.,recS6lAfPGhoud8Zl,,"You can apply for Basic Food Assistance online at washingtonconnection.org, by phone, or at your local Community Services Office.

",,,,,,,,Vetted,
Housing and Essential Needs,DSHS (Washington State Department of Social and Health Services),recgasOSzMjIX2vGR,HEN,Provides access to essential needs items and potential rental assistance for low-income individuals who are unable to work for at least 90 days due to a physical and/or mental incapacity. ,Bellingham Community Services Office (DSHS),rectPhCnrZMP8Rl6q,https://www.dshs.wa.gov/esa/community-services-offices/housing-and-essential-needs-hen-referral-program,,(877) 501-2233,,"Help Pay for Housing,Disability Benefits,Money,Government Benefits","recJYGDCounIMHC0T, recZhCS1KPf0NEvHf, recPlzafaM95ikCqj, recIiMl04p86EPI38",4101 Meridian St.,recrM2Ipp11NkSM5h,,"You can apply for Cash Assistance online at washingtonconnection.org, by phone, or at your local Community Services Office.",,,,,,,,Vetted,
"Aged, Blind, or Disabled Program",DSHS (Washington State Department of Social and Health Services),recgasOSzMjIX2vGR,ABD,"Health care coverage for individuals who are age 65 and over, blind or disabled who meet income and resource requirements.

",Bellingham Community Services Office (DSHS),rectPhCnrZMP8Rl6q,https://www.dshs.wa.gov/esa/community-services-offices/aged-blind-or-disabled-abd-program,,(877) 501-2233,,"Help Pay for Healthcare,Disability Benefits,Disability","recgLjAwF3IVODcJi, recZhCS1KPf0NEvHf, recLKLYZv41O8jPT4",4101 Meridian St.,recuoDC3fNSiL6Y9y,,,,,,,,,,Vetted,
Temporary Assistance for Needy Families,DSHS (Washington State Department of Social and Health Services),recgasOSzMjIX2vGR,TANF,Provides temporary cash assistance for families in need. Some families participate in the WorkFirst Program. The WorkFirst Program helps participants find and keep jobs.,Bellingham Community Services Office (DSHS),rectPhCnrZMP8Rl6q,https://www.dshs.wa.gov/esa/community-services-offices/tanf-and-support-services,,(877) 501-2233,,"Money,Financial Assistance,Government Benefits,Families,Parents","recPlzafaM95ikCqj, recbgFtOSl3oWCDSE, recIiMl04p86EPI38, recOs8jW9d2WJDhsu, rec4cE8qW6kVNk0bV",4101 Meridian St.,recoafNrFKTr1MM19,,"You can apply for TANF online at washingtonconnection.org, by phone, or at your local Community Services Office.",,,,,,,,Vetted,
Pregnant Woman Assistance Program,DSHS (Washington State Department of Social and Health Services),recgasOSzMjIX2vGR,PWA,A state-funded program that provides women who are low-income and pregnant and who are not eligible for Temporary Assistance for Needy Families or State Family Assistance with cash assistance and a referral to the HEN program. This program provides a maximum monthly cash grant of $363.,Bellingham Community Services Office (DSHS),rectPhCnrZMP8Rl6q,https://www.dshs.wa.gov/esa/community-services-offices/pregnant-women-assistance-pwa-program,,(877) 501-2233,,"Pregnant,Money,Financial Assistance,Government Benefits","receH7Eb28JwIIF3S, recPlzafaM95ikCqj, recbgFtOSl3oWCDSE, recIiMl04p86EPI38",4101 Meridian St.,recwljg57zR408jBi,,"You can apply for PWA online at washingtonconnection.org, by phone, or at your local Community Services Office.",,,,,,,,Vetted,
Refugee Cash Assistance,DSHS (Washington State Department of Social and Health Services),recgasOSzMjIX2vGR,RCA,Helps eligible refugees and other humanitarian immigrants by providing cash assistance for up to eight months from their arrival date in the United States (or from the date of their immigration status for asylees or victims of trafficking). RCA is for eligible people who do not have minor children.,Bellingham Community Services Office (DSHS),rectPhCnrZMP8Rl6q,https://www.dshs.wa.gov/esa/community-services-offices/refugee-cash-assistance,,(877) 501-2233,,"Money,Financial Assistance,Government Benefits,Refugees,Human Trafficking Survivors","recPlzafaM95ikCqj, recbgFtOSl3oWCDSE, recIiMl04p86EPI38, recsYn0kyO8PB5aI3, recO1muVN8SGaguLJ",4101 Meridian St.,recHfNnbpUDNuEHis,,"You can apply for RCA online at washingtonconnection.org, by phone, or at your local Community Services Office.",,,,,,,,Vetted,
Division of Child Support,DSHS (Washington State Department of Social and Health Services),recgasOSzMjIX2vGR,,Support services for paying and receiving child support.,Bellingham Community Services Office (DSHS),rectPhCnrZMP8Rl6q,https://www.dshs.wa.gov/esa/division-child-support,,800-442-KIDS (5437),,"Families,Parents","recOs8jW9d2WJDhsu, rec4cE8qW6kVNk0bV",4101 Meridian St.,reczqW5sznapW5ou0,,,,,,,,,,Vetted,
Division of Vocational Rehabilitation,DSHS (Washington State Department of Social and Health Services),recgasOSzMjIX2vGR,DVR,"A statewide resource assisting people with disabilities to prepare for, secure, maintain, advance in, or regain employment. DVR serves people who seek meaningful, secure employment but whose disabilities may result in one or more barriers to achieving an employment goal. ",Bellingham Community Services Office (DSHS),rectPhCnrZMP8Rl6q,https://www.dshs.wa.gov/dvr,,(360) 812-6610,,"Disability,Work,Help Find Work","recLKLYZv41O8jPT4, recgLX6b1UIeYq0PK, recD0R7SNBKL1THVr",4101 Meridian St.,rec3gbfCH2e8YzAQp,,Contact DSHS by phone or at your local Community Services Office for application.,,,,,,,,Vetted,
Aging and Long-Term Support Administration,DSHS (Washington State Department of Social and Health Services),recgasOSzMjIX2vGR,ALTSA,Provides assistance to seniors and people with disabilities in need of state-funded care services.,DSHS Home and Community Services Office,recNIwXXXKCspwafW,https://www.dshs.wa.gov/altsa,,,,"Seniors,Disability,Care,Residential Care,Assisted Living,Nursing Home,In-Home Support","recJnEdhIA6wUbdzg, recLKLYZv41O8jPT4, recFynVbJhP9DcOwP, recjrbb2HSgyaHdpa, recWuNvvhh3c22KDA, recqyhi6r39JFnOto, recVeQlFTV6sovBoc",2219 Rimland Dr.,recMlrpBFlK6qKgG9,,,,,,,,,,Vetted,
Developmental Disabilities Administration,DSHS (Washington State Department of Social and Health Services),recgasOSzMjIX2vGR,DDA,"Programs for people with developmental disabilities, including services for personal care, respite, employment, residential supports, and more.  ",,,https://www.dshs.wa.gov/dda,DDA2IETEAM@dshs.wa.gov,(800) 788-2053,,"Developmental Disability,Disability","recyhyWOEEXd1S4PP, recLKLYZv41O8jPT4",,recOpDqPpDQJOM18w,,,,,,,,,,Vetted,
Adult Protective Services,DSHS (Washington State Department of Social and Health Services),recgasOSzMjIX2vGR,APS,"Report concerns involving vulnerable adults online, by phone, fax, or email.",,,https://www.dshs.wa.gov/altsa/home-and-community-services/report-concerns-involving-vulnerable-adults,apscentralintake@dshs.wa.gov,1-877-734-6277,,"Help Hotlines,Immediate Safety,Physical Safety,Seniors,Disability","recCaUmmFlIV3UOwU, recGwLimJylbPv5Hz, recDy1vhq7JShgaBn, recJnEdhIA6wUbdzg, recLKLYZv41O8jPT4",,recOvRmqVkKJwUq9S,,,,,,,,,,Vetted,
Office of Refugee and Immigrant Assistance,DSHS (Washington State Department of Social and Health Services),recgasOSzMjIX2vGR,,"Services to support refugee and immigrant families and individuals in Washington State. Services include cash, food, and medical benefits; employment and training; naturalization services; health and mental health services; and more.",,,https://www.dshs.wa.gov/esa/office-refugee-and-immigrant-assistance,,(877) 501-2233,,"Refugees,Undocumented,Citizenship & Immigration,Citizenship,Immigrants","recsYn0kyO8PB5aI3, recr7K6vtcMjUaPyI, recRYIKf9jodCgKdr, recCWrkR6OTH6jyJB, recbiCoPYceNUp021",,recYZ7MknxmwPv5jx,,"You can apply for assistance online at washingtonconnection.org, or at your local Community Services Office.",,,,,,,,Vetted,
