name,alternate_name,x-status,x-verification,Service Area,phones,url,description,services,email,locations,contacts,x-website rating,x-logo,legal_status,x-status_last_modified
The Sergey Foundation,,,,Whatcom County,,http://sergeyfoundation.org/index.html,Assists households on limited income with emergency veterinary care for companion animals. Application on website.,,sergeyfoundation@yahoo.com,The Sergey Foundation,,,,,
"Veterans of Foreign Wars, Post #1585",,,,Whatcom County,,https://vfwpost1585.wordpress.com,"See web site for events calendar. The VFW Foundation’s mission is simple: support programs to increase awareness of the sacrifices of America’s veterans; promote citizenship education, volunteerism and positive youth programs; and facilitate medical, rehabilitative, educational and employment services and needs for veterans and their families.",,,Veterans of Foreign Wars Post 1585,,,,,
Welcome Valley Senior Center,,,,Whatcom County,(360) 592-5403,,"Hrs. Th: 9am-3pm. Summer hours vary, call ahead.  Senior activity center, meals served at noon.",,,Welcome Valley Senior Center,,,,,
Westcoast Counseling and Treatment Center,,,,Whatcom County,(360) 647-7577,http://www.whatcomcounseling.org/drug-and-alcohol-counseling,"Hrs. M-Th: 9am-6pm. F: 9am-2pm.  Provides outpatient substance abuse treatment service, serving criminal justice clients.",,,Westcoast Counseling and Treatment Center,,,,,
Whatcom Community College,,,,Whatcom County,(360) 383-3000,http://www.whatcom.ctc.edu,"Offers associates degrees, general studies, ESL and Adult Basic Education to prepare for GED, professional/technical areas, programs for academic and occupational success. ",,,Whatcom Community College,,,,,
Whatcom County Behavioral Health Triage Center,,,,Whatcom County,(360) 676-2020,http://www.compasshealth.org,"24 hrs. a day, seven days a week. Whatcom Community Detox, Crisis Intervention and Respite, mental health assessment & referral.",,,Whatcom County Behavioral Health Triage Center,,,,,
Whatcom County Pregnancy Clinic,,,,Whatcom County,(360) 671-9057,http://www.whatcomclinic.com/,"Hours: Monday-Friday 9:00a-5:00p. Services provided include: pregnancy tests, free STI testing, ultrasounds, EWYL parenting classes, childbirth education, free and confidential services.",,,Whatcom County Pregnancy Clinic,,,,,
Whatcom Dispute and Resolution Center,,,,Whatcom County,(360) 676-0122,http://www.whatcomdisputeresolutioncenter.org/,"Hrs. T-F: 10am-5pm Mediation services and trainings in conflict resolution working with young people and adults, families, businesses and organizations.",,,Whatcom Dispute Resolution Center,,,,,
Whatcom Family and Community Network,,,,Whatcom County,(360) 738-1196,http://www.wfcn.org,"Hrs M-F: 8am-4:30pm. Focusing on community organizing at both the neighborhood and county-wide level to build the capacity to support children, youth and families to develop skills and opportunities. ",,,Whatcom Family and Community Network,,,,,
Whatcom Hospice Foundation,,,,Whatcom County,(360) 733-5877,http://www.hospicehelp.org/,Hrs. M-F: 8:30am-5pm.  Services for people who have a prognosis of six months or less to live.  Home visits and 12-bed hospice house.  ,,,Whatcom Hospice Foundation,,,,,
Whatcom Human Rights Task Force,,,,Whatcom County,,http://www.whrtf.org/,Dedicated to promoting and protecting the rights of the human family. Operates within Whatcom Peace and Justice Center. ,,,Whatcom Human Rights Taskforce,,,,,
Whatcom Humane Society ,,,,Whatcom County,(360) 733-2080,http://www.whatcomhumane.org/index.php?outreach,"Hrs: W-Sat. 10am-6pm: Sun.-Mon. 11am-5pm at both Whatcom Humane Society locations: Division St. & Baker Creek- 1661 Baker Creek Place, Bellingham, WA 98226.   ",,,Whatcom Humane Society,,,,,
Whatcom Land Trust,,,,Whatcom County,(360) 650-9470,http://www.whatcomlandtrust.org/,Hrs. M-F: 8:30am-5pm. Preservation of unique natural and open-space land in the county.,,,Whatcom Land Trust,,,,,
Whatcom Literacy Council,,,,Whatcom County,(360) 752-8678,http://www.whatcomliteracy.org/,Hrs. M-F: 9am-5pm. Provides free basic literacy & English as a second language. ,,,,,,,,
Whatcom Self-Help Homes,,,,Whatcom County,(360) 398-0223 or 888-360-0223,http://www.whatcomskagithousing.com,Hrs. M-F: 8:30am-5pm. Provides assistance to limited income people to build their own homes. ,,,Whatcom Self-Help Homes,,,,,
"DCYF (Washington State Department of Children, Youth, and Families)",,Vetted,DCYF,Washington State,,https://www.dcyf.wa.gov,"The lead agency for state-funded services that support children and families to build resilience and health, and to improve educational outcomes. ","Child Protective Services,Child Abuse Hotline,Foster Parenting and Kinship Care,Foster Parent and Caregiver Support line,Adoption Support Program",,,,5,,,3/31/2022 9:32am
DSHS (Washington State Department of Social and Health Services),,Vetted,DSHS,Washington State,(877) 501-2233,https://www.dshs.wa.gov,Washington's social services department.,"Basic Food,Housing and Essential Needs,""Aged, Blind, or Disabled Program"",Temporary Assistance for Needy Families,Pregnant Woman Assistance Program,Refugee Cash Assistance,Office of Refugee and Immigrant Assistance,Division of Child Support,Division of Vocational Rehabilitation,Aging and Long-Term Support Administration,Developmental Disabilities Administration,Adult Protective Services",,Bellingham Community Services Office (DSHS),,5,,,3/31/2022 9:32am
"CLEAR (Coordinated Legal Education, Advice and Referral) ",,Vetting In Progress,,Washington State,,https://nwjustice.org/get-legal-help,"Hrs. M-F: 9:15am-12:15pm. NW Justice Project’s phone service for eligible low income people to obtain free legal assistance with civil legal problems. Available to all seniors.  For an online application to CLEAR, visit https://nwjustice.org/apply-online ",,,,,,,,6/13/2022 1:41pm
Washington Law Help,,Vetting In Progress,,Washington State,,http://www.washingtonlawhelp.org/,"Washington LawHelp is a guide to free civil legal services for low-income persons and seniors in Washington.  This site provides legal education materials and tools that give you basic information on a number of legal problems, and in some cases, detailed instructions and forms to help you represent yourself in court.  You can also locate information on free legal aid programs in Washington, including basic eligibility and contact information.",,,,,,,,6/13/2022 1:42pm
Washington State Domestic Violence Hotline,,Vetting In Progress,,Washington State,1-800-562-6025,https://wscadv.org/get-help-now/,Open daily from 8am-5pm.  Offers phone counseling and referrals to all state domestic violence programs. ,,,,,,,,6/13/2022 1:42pm
211-North Sound,,,,Washington State,211 or 1-800-223-8145,http://www.voaww.org/211,Hrs. M-F: 8am-5pm. Information and referral line for social services.,,,,,,,,
Alzheimer Society of Washington Support Center,,,,Washington State,(360) 671-3316,http://www.alzsociety.org,Hrs. M-F 8am-4pm. Resources for people or caregivers of people with Alzheimers or other dementia related illnesses.,,alz@alzsociety.org,Alzheimer Society of Washington Support Center,,,,,
Attorney General of Washington,,,,Washington State,(360) 676-2037,http://www.atg.wa.gov/,"Provides consumer protection for identity theft and scams, education, labor and industries, licensing, social and health services.",,,Attorney General of Washington,,,,,
Conservation Northwest ,,,,Washington State,(360) 671-9950,http://www.conservationnw.org/,"“Keeping the Northwest wild” by protecting old-growth forests and other wildlands, connect large landscapes and vital habitats, and restore native wildlife.",,,Conservation Northwest,,,,,
Dental Care for Persons with Disabilities ,,,,Washington State,(206) 543-4619,https://dental.washington.edu/patient/clinics/decod/,For people with developmental and/or acquired disabilities that need special treatments supports.  Medicaid and private insurance accepted.  Application required; Cell for more information,,,University of Washington School of Dentistry Clinic,,,,,
Department of Labor & Industries-WA ,,,,Washington State,(360) 647-7300,http://www.lni.wa.gov/,"Hrs. M-F: 8am-5pm.  Workplace safety issues, worker’s comp insurance and rights, labor and consumer protection, trades licensing, contractor registration and license look up.",,,Department of Labor and Industries,,,,,
Disability Rights Washington  ,,,,Washington State,"Please use 711 for TTY,1-800-562-2702,(206) 324-1521",http://www.disabilityrightswa.org/,"Private non-profit organization that protects the rights of people with disabilities statewide.  Our mission is to advance the dignity, equality, and self-determination of people with disabilities.  We work to pursue justice on matters related to human and legal rights.",,,Disability Rights Washington,,,,,
Family Caregiver Support Program-Northwest  Regional Council,,,,Washington State,(360) 676-6749,http://www.nwrcwa.org/family-caregiver-support-program/,"Hrs. M-F: 8am-5pm. Provides support and services for unpaid family caregivers in Island, San Juan, Skagit, and Whatcom counties. 
Island County
Camano Island: 360-387-6201
Coupeville: 360-678-4886
Oak Harbor: 360-675-0311
South Whidbey: 360-321-1600
San Juan County
Lopez, Shaw, Center, Decatur: 360-468-2421
Orcas, Blakely, Waldron: 360-376-2677
San Juan, Brown, Henry, Stuart: 360-378-2677
Skagit County: 360-428-1301
Whatcom County: 360-676-6749",,,,,,,,
Hazardous Substance Information Website,,,,Washington State,,https://ecology.wa.gov ,"Information and Education  about hazardous substances in your community, home, workplace, and school.",,,Washington State Department of Ecology,,,,,
Hearing Speech and Deafness Center ,,,,Washington State,(360) 647-0910  Videophone (360) 255-7166,http://www.hsdc.org/,"Hrs. M-F: 8:30am-5pm. Information and referral services, advocacy and educational programs related to hearing loss, disability rights",,,Hearing Speech and Deafness Center,,,,,
Lifeline Connections,,,,Washington State,(360) 922-3030,http://www.lifelineconnections.org,"Lifeline Connections offers a full complement of inpatient, outpatient and aftercare treatment, including a Medication-Assisted Recovery program for people with opioid use and/or alcohol use disorders. Our programs are designed with the needs of the individual in mind, and treatment is built on evidence-based, best-practice standards and protocols.
 

Hrs: Mon-Fri 8:30am-5:30pm l Walk-in MAT Rapid Response Clinic Mon & Wed 8:00am – 2:00pm, Tue & Thurs 8:00am – 10:00am
l Walk-in assessments Mon-Wed 12:00pm-3:30pm l",,,Lifeline Connections,,,,,
Mental Health Central Access Line ,,,,Washington State,1-888-693-7200,,Provides an initial authorization for mental health assessment and referral to clinic for diagnosis and treatment for those receiving Medicaid,,,,,,,,
Missing Persons Information Center ,,,,Washington State,1-800-543-5678 (24 hrs.),http://www.waspc.org/missing-persons-information,Missing & Unidentified Persons Unit (MUPU) assists law enforcement agencies and parents in locating missing persons. Local law enforcement must be notified before MUPU can become involved.,,,Missing Persons Information Center,,,,,
Northwest Clean Air Agency ,,,,Washington State,,http://www.nwcleanair.org/,"Hrs, M-F: 8am-4:30pm. Northwest Clean Air Agency has been the primary government agency responsible for protecting the air in Island, Skagit and Whatcom counties. We are responsible for enforcing federal, state and local air quality regulations at stationary sources of air pollution in our jurisdiction. Compiled information and tips into this online resource to help you keep your indoor air clean and healthy.",,,Northwest Clean Air Agency,,,,,
Northwest Immigrant Rights Project,,,,Washington State,(206) 587-4009 or 1-800-445-5771,http://www.nwirp.org,Hrs. M-F 9:30am-12pm and 1pm-4:30pm. Provides comprehensive immigration legal services and community education to advance the human rights and well-being of low-income immigrants and refugees. ,,,,,,,,
Office of Mobile and Manufactured Housing,,,,Washington State,1-800-964-0852,http://www.commerce.wa.gov/building-infrastructure/housing/mobile-home-relocation-assistance/,Provides information on mobile and manufactured home relocation assistance and laws associated with mobile home relocation and parks in Washington State.,,,Office of Mobile and Manufactured Homes,,,,,
SHIBA Helpline (Statewide Health Insurance Benefits Advisors) - Medicare,,,,Washington State,"or 800-562-6900,(360) 734-5121 ext. 465",,"The SHIBA program is a network of trained volunteers who educate consumers about their Medicare options and rights. They can help with evaluation of medicare supplement coverage, prescription assistance programs, right and protections, and filing medicare complaints.",,,,,,,,
Solid Ground Landlord/Tenant Information & Hotline,,,,Washington State,(206) 694-6767,https://www.solid-ground.org/get-help/housing/for-tenants/,"Tenant services hotline is a message-only line, open Monday and Thursday: 10:30am-1:30pm, and Wednesday 1:30-4:30pm. Website providing tenants the resources and tools they need to prevent eviction and ensure housing stability. ",,,,,,,,
Veterans Community Based Outpatient Clinic,,,,Washington State,,http://www.pugetsound.va.gov/docs/Mount_Vernon_CBOC_Handout.pdf,"Hrs: M-F 8am-4:30pm for primary care, mental health services, social work serivces, vision and hearing services, lab services, and pharmacist medication reviews. For transportation assistance to clinic, contact Whatcom Volunteer Center at (360) 734-3055 ",,,Veterans Community Based Outpatient Clinic,,,,,
Washington Access Fund,,,,Washington State,(206) 328-5116,www.washingtonaccessfund.org,We provide funding to people with disabilities in Washington and Oregon to purchase assistive technology and achieve greater independence. Provides low-interest loans and matched savings accounts for assisted technology and business equipment.,,,Washington Access Fund,,,,,
Washington Homeownership Resource Center,,,,Washington State,1-877-894-4663,http://www.homeownership-wa.org/,"Hrs. M-F: 8:30am-4:30pm. The Washington Homeownership Resource Center (WHRC) is dedicated to educating and empowering current and future homeowners in Washington State. We offer a website, hotline, and portal where you will find resources for first-time homebuyers, current homeowners, and homeowners who may be facing foreclosure. Through our portal, our agency partners within the state will be able to view a client’s profile in order to better assist them.",,,Washington Homeownership Resource Center,,,,,
Washington Landlord Association,,,,Washington State,,http://waapt.org,WLA is a comprehensive pool of knowledge regarding landlord issues - statewide. We are the go-to organization for finding out how governmental issues affect your business.,,,Washington Landlord Association,,,,,
Washington Poison Center,,,,Washington State,"1-800-572-0638 (TTY),1-800-222-1222 (24 hrs)",http://www.wapc.org/,24 hrs. Responds to calls involving poisoning of both humans and animals. ,,,Washington Poison Center,,,,,
Washington State Coalition Against Domestic Violence,,,,Washington State,"(206) 389-2900 (TTY),(206) 389-2515",http://www.wscadv.org/,Hrs. M-Th: 9am-5pm & F: 9am-12pm.  Provides advocacy and action to help end domestic violence. ,,,Washington State Coalition Against Domestic Violence,,,,,
Washington State Department of Licensing,,,,Washington State,(360) 676-2096,http://www.dol.wa.gov/,"Hrs. T,W,F: 8:30am-5pm, Th: 9:30am-5pm, Sat: 8:30am-2:30pm.  Provides Driver’s licenses & ID cards. ",,,Washington State Department of Licensing Bellingham,,,,,
Washington State Housing Finance Commission,,,,Washington State,,http://www.wshfc.org,"Free pre-purchase and housing foreclosure counseling. We are a publicly accountable, self-supporting team, dedicated to increasing housing access and affordability and to expanding the availability of quality community services for the people of Washington.",,,Washington State Housing Finance Commission,,,,,
Washington Talking Book and Braille Library,,,,Washington State,"(206) 615-0400,1-800-542-0866 (toll free)",http://www.wtbbl.org/,"Hrs. M-F: 8:30am-5pm. Provides a free public library service needed by individuals in Washington State who are unable to read standard print material.  Books in braille, large print, and audio available to be mailed throughout the state of Washington.",,,Washington Talking Book and Braille Library,,,,,
Washington Women In Need,,,,Washington State,(425) 451-8838 or 888-440-9946,http://www.wwin.org/,"Washington Women in Need believes in the power of determined women to transform their lives and the course of their families’ lives for generations to come. We address a deep need in society, providing women a hand up to improve their futures, in turn, strengthening their families and our societies as a whole.
We make financial grants to low-income women in Washington State who are ready for transformational change in two categories: Education and Health Care.",,,Washington Women in Need,,,,,
Skagit County Community Action Agency,,,,Skagit County,(360) 416-7585,https://communityactionskagit.org,"Hrs. M-F: 8:30am-5pm. Provides information & services for low-income families in Skagit County. Energy Assistance, WIC, family support, veteran’s services,, employment services, legal aid, and housing resources.",,,Skagit County Community Action,,,,,
Alcoholics Anonymous,,,,National,"(360) 318-5764 (Español),(360) 734-1688",http://www.whatcomaa.org/,"Support group for people dealing with alcohol addictions.  Call or go online for a list of meeting times.
Island County: (888) 360-1564
Skagit County: (360) 428-7155
South Whidbey: (360) 221-2070",,,,,,,,
Arthritis Foundation,,,,National,"1-800-542-0295,(360) 733-2866",http://www.arthritis.org/,"Hrs. M-F: 9am-5pm. Education, information, support groups, exercise programs and self-help courses for people with Arthritis.  Also hold community fundraising events like the Jingle Bell Run and Golf Tournament.",,,Arthritis Foundation,,,,,
ClearPoint Credit Counseling Solutions ,,,,National,(800) 750-2227,https://www.clearpoint.org,"Hrs. M-F: 7am-11pm Sat: 8am-8pm. (Eastern Time) Assists with financial concerns through free effective counseling, education and advocacy.  Program includes work with a specialist for debt reduction, bankruptcy counseling, and homeowners assistance by phone,  online, or in person. Many services are free, others at a low cost.",,,ClearPoint Credit Counseling Solutions,,,,,
Express Employment Professionals ,,,,National,(360) 734-2457,http://www.expresspros.com ,Hrs. M-F: 8am-5pm.  Provides assistance w/ employment. Temporary to permanent employment. Paid weekly.,,,Express Employment Professionals,,,,,
Ideal Option,,,,National,24-hr scheduling line,https://idealoption.net/#toggle-id-10,"Treats addiction for opioids, methamphetamines, alcohol, tobacco, and other substances with Suboxone, Subutex, Buprenorphine, and Zubsolv.",,,Ideal Option,,,,,
Kelly Temporary Services ,,,,National,(360) 647-2207,http://www.kellyservices.com/,Hrs. M-F: 8am-5pm. Staffing agency with office and light industrial temporary to hire positions available. Paid weekly,,,Kelly Temporary Services,,,,,
Labor Ready,,,,National,(360) 647-7642,http://www.peopleready.com,"Hrs. M-F: 5:30am-6pm, Sat:7am-11am. Employment in construction & physical labor, housekeeping, food processing, both skilled and unskilled.   ",,,Labor Ready,,,,,
Manpower  ,,,,National,(360) 671-1977,http://www.manpower.com/,Hrs. M-F: 8:00am-5:00pm. Provides temporary and permanent employment options.,,,Manpower,,,,,
Narcotics Anonymous ,,,,National,(360) 647-3234,,Support for people with drug addictions. Meetings are held daily.  Call or visit the website for current schedule.  ,,,,,,,,
National Call Center for Homeless Veterans ,,,,National,1-877-424-3838,http://www.va.gov/homeless/nationalcallcenter.asp,Department of Veteran Affairs toll-free 24 hour access to VA counselors and other resources.  For veterans who are homeless or at risk of homelessness. Online chat also available on their website.,,,,,,,,
National Domestic Violence Hotline ,,,,National,"1-800-787-3224 (TTY),1-800-799-7233",http://www.thehotline.org/,"24 hour hotline.  Habla español.  Our highly-trained advocates are available 24/7 to talk confidentially with anyone experiencing domestic violence, seeking resources or information, or questioning unhealthy aspects of their relationship. Online chat also available on their website.",,,,,,,,
National Hopeline Network- Suicide Prevention ,,,,National,1-800-SUICIDE (784-2433) or 1-800-442-HOPE (4673),http://www.hopeline.com/,National hotline for anyone thinking about suicide and/or their family and friends. Online Chat available on their website.,,,,,,,,
National Sexual Assault Hotline ,,,,National,1-800-656-4673,,24 hrs.  Hotline will connect you to local counseling and health care resources. Online Chat also available.,,,,,,,,
Operation Home Free - National Runaway & Youth Crisis Hotline  ,,,,National,1-800-RUN-AWAY/1-800-786-2929 24/7 toll free #,,Youth crisis hotline. National switchboard for the Operation Home Free Program which arranges for rides home for youth ages 12-21 on greyhound bus lines.,,,,,,,,
Share the Love - Cloth Diaper Bank,,,,National,,http://www.cottonbabieslove.com,"Cloth diaper loaner bank for low income families with children birth to 3 years.  Families qualify if they receive any form of government assistance, including apple health for kids. Apply through the website.  ",,,,,,,,
Social Security,,,,National,1-800-772-1213,http://www.ssa.gov/,"Hrs. M,T,Th,F:9am-4pm. W:9am-12pm  Application to Social Security, Supplemental Security Income, Social Security Disability and information on programs",,,,,,,,
Social Security Administration - Medicare,,,,National,1-800-772-1213,http://www.ssa.gov,"Hrs. M,T,Th,F:9am-4pm. W:9am-12pm. Federal health insurance program for people 65 yrs.  or older, or for those receiving SSA disability ",,,,,,,,
Supplemental Security Income (SSI),,,,National,"1-800-772-1213,(360) 738-3952",http://www.ssa.gov/,"Hrs. M-F: 9am-4pm. Income for the blind, disabled, or 65 and older on little or no income.",,,Social Security Administration,,,,,
Trans Lifeline,,,,National,,https://www.translifeline.org,"Trans Lifeline is a national trans-led 501(c)(3) organization dedicated to improving the quality of trans lives by responding to the critical needs of our community with direct service, material support, advocacy, and education. Our vision is to fight the epidemic of trans suicide and improve overall life-outcomes of trans people by facilitating justice-oriented, collective community aid. ",,,,,,,,
United States Consumer Product Safety Commission Hotline,,,,National,1-800-638-2772,http://www.cpsc.gov/,"Information on unsafe/recalled products nationwide. Toll free consumer hotline 8a-5:30p ET, can leave a message at anytime
",,,,,,,,
Veterans Crisis Line,,,,National,"press 1 or text to 838255,1-800-273-8255",http://veteranscrisisline.net/,"The Veterans Crisis Line connects Veterans in crisis and their families and friends with qualified, caring Department of Veterans Affairs responders through a confidential toll-free hotline, online chat, or text. Veterans and their loved ones can call 1-800-273-8255 and Press 1, chat online, or send a text message to 838255 to receive confidential support 24 hours a day, 7 days a week, 365 days a year. Support for deaf and hard of hearing individuals is available. ",,,,,,,,
Victim Support Services,,,,National,"24 Hr. Crisis line:1-888-288-9221,(360) 756-1780",http://victimsupportservices.org,"Criminal justice system advocacy, resources, referrals, educational and support services for victims of crime and their families.  Victim Support Services has been providing peer support and advocacy for victims of crime since 1975. Services are free of charge.  Serve victims of Adult Missing Persons,  Arson, Assault, Burglary, Elder Abuse, Fraud, Gang Violence, Hate Crimes, Homicide, Human Trafficking, Identitiy Theft, Robbery, Vehicular Assault, Vehicular Homicide.",,,,,,,,
VOA Care Crisis Line and Online Chat,,,,National,1-800-584-3578,https://www.voaww.org/behavioralhealth,"Available 24/7, 365 Days a year to speak with a licensed mental health professional. Offers emotional support, crisis intervention and referral to individuals in crisis or considering suicide.  Chat available on their website.",,,,,,,,
Big Brothers Big Sisters -Island Co.,,,,Island County,(360) 279-0644,http://www.bbbsislandcounty.org/,Youth mentoring for children ages 6-15.,,,Big Brothers Big Sisters of Island County,,,,,
Boys & Girls Club of Oak Harbor,,,,Island County,,https://bgcsc.org/snohomish-clubs/oak-harbor-club/ ,"Before school hrs: M-F: 6:45-9am, After school hrs: M: 2:30pm-6pm, T-F: 3pm-6pm, Summer/Non-School Days hrs: M-F: 6:45am-6pm.  Programs are designed to meet the physical, emotional, cultural and social needs and interests of the community. ",,,Boys and Girls Club of Oak Harbor,,,,,
CADA,,,,Island County,(360) 675-7057  OR  24 HR Hotline 1-800-215-5669,http://www.cadacanhelp.org/,"Hrs. M-F: 9am-5pm. Provides assistance to victims of domestic violence, sexual abuse, child sexual abuse and sexual harassment. ",,,CADA,,,,,
"DSHS, Island County ",,,,Island County,(877) 501-2233,https://www.dshs.wa.gov,"Hrs: M-F 8am-5pm.  Provides multiple program services (TANF, Basic Food, Medical, WorkFirst)",,,DSHS Island County,,,,,
Friends of Friends Medical Support Fund  ,,,,Island County,,http://www.fofmedicalsupportfund.org/,"A community-supported fund offering financial help for South Whidbey residents. Helps with uncovered medical expenses for doctors, hospitals, labs, transportation, supplies and equipment, and prescription drugs.  ",,,Friends of Friends Medical Support Fund,,,,,
