name,alternate_name,x-status,x-verification,Service Area,phones,url,description,services,email,locations,contacts,x-website rating,x-logo,legal_status,x-status_last_modified
Good Cheer Clinton Thrift Store & The Rack ,,,,Island County,,http://www.goodcheer.org/,"Open 7 Days a week from 9:30a to 5pm.  Offers everything from furniture to clothing for the family to home decor and seasonal decoration, to a “man-cave” with tools, appliances and electronics.",,,Good Cheer Clinton Thrift Store & the Rack,,,,,
Good Cheer Food Bank /Distribution Center ,,,,Island County,,http://www.goodcheer.org/,"Open Mon, Wed-Sat from 9:30a to 4:30p and Tues from noon to 7pm. ",,,Good Cheer Food Bank and Distribution Center,,,,,
Good Cheer Thrift Store Langley ,,,,Island County,,http://www.goodcheer.org/,"Hrs. 7 days a week 9:30am-5:pm offers collectibles  antiques, housewares, seasonal decorations, kitchenware, clothing and shoes for the entire family, linens, fabric and craft items, a toy department, artwork, used books, estate jewelry, electronics, and  furniture. Our selection is added to daily, so browse often, and remember, when you shop Good Cheer Thrift Stores, you are shopping to feed families!",,,Good Cheer Thrift Store Langley,,,,,
Habitat for Humanity - Island County,,,,Island County,,http://www.islandcountyhabitat.org/,"Volunteers build houses for low-income families who have been chosen on the basis of need for adequate shelter.  Selected families must contribute 500 hours of sweat  equity on the construction of the house which is then sold to them through a no profit, no interest, mortgage.  This can last from the time a family is selected, to the time the project is completed, can be as long as 1 1/2 years.
",,,Island County Habitat for Humanity,,,,,
Habitat for Humanity Store - Island Co. Freeland,,,,Island County,(360) 331-6272,http://www.islandcountyhabitat.org/stores.html,"Hrs: Mon-Sat: 10am-5pm and Sunday 11a to 4p. Sells quality used home and office furniture, appliances, and mattresses.  Proceeds go towards building affordable housing for low income families in Island County.  Provides free pickup of donated items.",,,Habitat for Humanity Store Island County,,,,,
Habitat for Humanity Store - Island County,,,,Island County,,http://www.islandcountyhabitat.org/ ,"Hrs: Mon-Sat: 10am-5pm and Sunday 11a to 4p. Sells quality used home and office furniture, appliances, and mattresses.  Proceeds go towards building affordable housing for low income families in Island County.  Provides free pickup of donated items.",,,,,,,,
"Head Start and Early Head Start, Oak Harbor",,,,Island County,,http://www.headstartprogram.us/city/wa-oak_harbor,"Classrooms are developmentally appropriate, based on the needs of the children enrolled and the goals set for them by Head Start and their parents. 
",,,Oak Harbor Head Start and Early Head Start,,,,,
Help House Food Bank ,,,,Island County,,,"Hrs: M,W,Th,F 8-4; Tu 8-5; closed 12-1.  Food Bank serving residents of North Whidbey Island- Deception Pass to Bakken Rd in Greenbank.  Also offers the Salvation Army’s prescription fund and holiday baskets.",,,Help House Food Bank,,,,,
Helping Hand South Whidbey ,,,,Island County,,http://helpinghandofsouthwhidbey.org/,"Hrs: M-F 9am-12pm.  Provides immediate financial assistance to residents of South Whidbey when basic services of life and well-being are in danger of being discontinued, and makes referrals for longer-term assistance.",,,Helping Hand South Whidbey,,,,,
HOPE Therapeutic Riding Center ,,,,Island County,(360) 221-7656,http://www.hope-whidbey.org,HOPE offers individual and group therapeutic recreational English-style riding lessons to people of all ages with disabilities on Whidbey Island. Cost is $40 but may be covered by health insurance.,,,HOPE Therapeutic Riding Center,,,,,
Island County Health Dept.,,,,Island County,(360) 679-7350,https://www.islandcountywa.gov/Pages/Home.aspx,Community and Family Health Services.  Open 8am to 4:30pm,,,Island County Health Department,,,,,
New Leaf ,,,,Island County,,http://www.newleafinc.org/,"Hrs. M-F 8am-4pm, closed 12-1pm; New Leaf’s mission is to promote independence and quality of life through employment. Provides jobs to people with disabilities and employment assessment.  Programs for job training, independent living evaluation, and support service.",,,New Leaf,,,,,
Opportunity Council Island County Back Pack Program,,,,Island County,,www.oppco.org,Annual program in August to provide back packs/school supplies to very low income and homeless school aged children on North Whidbey.,,,Opportunity Council Island County,,,,,
Opportunity Council Island County Rental Assistance,,,,Island County,(360) 679-6577 or 1-800-317-5427,www.oppco.org,Rental assistance for income qualified households.  Call for eligibility. ,,,,,,,,
Opportunity Council Island County Solid Waste Program,,,,Island County,(360) 679-6577 or 1-800-317-5427,www.oppco.org,Issues 50% off solid waste passes for income qualified individuals in Island County.  Issued M-F 9-4 ,,,,,,,,
Pregnancy Care Clinic of Oak Harbor,,,,Island County,(360) 675-2096,http://islandspcc.org/,"Hours M-F 10am-4pm, Sat 10am-2pm Provides pregnancy testing, limited ultrasounds, free crib or car seat upon completion of parenting classes, baby clothing, diapers, formula, abstinence presentations and community referrals.  Free and confidential.",,,,,,,,
Pregnancy Care Clinic of South Whidbey,,,,Island County,,http://islandspcc.org/,"Hours W and Th 10am 4pm Provides pregnancy testing, limited ultrasounds, testing, free crib or car seat upon completion of parenting classes, baby clothing, diapers, formula, abstinence presentations and community referrals.  Free and confidential.",,,Pregnancy Care Clinic of South Whidbey,,,,,
"Preschool Head Start, Oak Harbor",,,,Island County,,http://www.sihs.skagit.edu/index.php,"Skagit/Islands Head Start & ECEAP, a Skagit Valley College program, provides high quality, happy, early-learning environments for children birth to five. We also provide culturally responsive services to the entire family, including home-based services to pregnant women. We understand that each child’s first and most important learning happens in the home, so we strive to work in partnership with families to ensure we are reaching the best possible outcomes for each individual child and family.

The program offers parents and guardians unique opportunities for support and growth. We believe the more adults participate, the more rewarding the experience will be for the child.",,,,,,,,
Readiness to Learn Coupeville,,,,Island County,,,"The Readiness To Learn Foundation is a non-profit organization that works in partnership with schools, communities and families. Our goal is to help each child reach their potential regardless of their circumstances. The Readiness To Learn Foundation is your one stop shop when you need information, encouragement or support. We can help.",,,,,,,,
Readiness to Learn South Whidbey,,,,Island County,(360) 221-6808 ext.4321,,"Family Resource Center located at SW Elementary School. Open Mon-Thurs 9-4p or by appointment. Follows the school calendar, closed when the school is closed. The Readiness To Learn Foundation is a non-profit organization that works in partnership with schools, communities and families. Our goal is to help each child reach their potential regardless of their circumstances. The Readiness To Learn Foundation is your one stop shop when you need information, encouragement or support. We can help.",,,Readiness to Learn South Whidbey,,,,,
Sea Mar Oak Harbor Dental Clinic,,,,Island County,,http://www.seamar.org/location.php?xloc=25&xser=2&xcty=11&xserloc=33,"Tues- Sat:  8am to 5pm.  Provides preventive and emergency dental care including cleaning of teeth, extraction, and fillings.",,,Sea Mar Oak Harbor Dental Clinic,,,,,
South Whidbey Commons,,,,Island County,,http://southwhidbeycommons.org/,"Hrs. 8am to 5pm, 7 days a week. Open later for events.  Promotes positive youth development and fosters a healthy community.  Provides youth job training, volunteer opportunities, family activities and lifelong learning experiences.",,,South Whidbey Commons,,,,,
Stanwood-Camano Community Resource Center,,,,Island County,(360) 629-5257,http://www.stanwoodcamanoresources.org/,"Hrs. M-F: 9am-5:30pm  Partnering with community agencies, the center provides financial resources for individuals and families who need assistance with paying their bills to prevent eviction or disconnection of services.  Also offers a variety of educational and fun programs for youth and adults. ",,,Stanwood-Camano Community Resource Center,,,,,
Stanwood-Camano Food Bank ,,,,Island County,(360) 629-2789,,"Hrs. W & F: 10am-1pm, Saturdays: 10a - 12p.  Transportation from the Stanwood Senior Center available the first and third Fridays between 9:15 and 9:45am",,,Stanwood-Camano Food Bank,,,,,
Toddler Learning Center,,,,Island County,,https://www.tlcwhidbey.org,"Hrs: M-Th 9am-4pm. North & Central Whidbey - 360-679-1039
South Whidbey - 360-221-6808 x4420
	•	Free developmental screening including vision & hearing for children 0-36 months of age.
	•	Comprehensive developmental evaluation & assessment in all areas.
	•	Developmental Therapy by an Infant Toddler Educator, Speech Language Pathologist, Occupational Therapist, Physical Therapist, and Parent Support Specialist.  Services available in the home, child care setting, and/or therapeutic classroom setting.
	•	Family support for accessing information and community resources.",,,Toddler Learning Center,,,,,
United Way of Island County,,,,Island County,,http://www.unitedwayic.org/,"Provides support and assistance to locally recognized charitable health, welfare and recreational agencies through an annual federated fund drive.  Currently provides funding to nine non-profits, encompassing 11 separate programs in Island County.  ",,,United Way of Island County,,,,,
Whidbey Animal Improvement Foundation (WAIF),,,,Island County,,http://www.waifanimals.org/,Hrs. W-Sun. 12pm-4pm. Adoption/Pets. Including their Senior for Senior pet adoption program which matches an adopter 65+ to a dog or cat 8+ and WAIF waives all adoption fees. ,,,Whidbey Animal Improvement Foundation (WAIF),,,,,
Worksource Whidbey,,,,Island County,,www.worksourcewa.com,"M-F, 8am to 12 pm and 1pm to 5pm. Job search, career exploration, computer use, training on resumes and cover letters, and interview preparation. Job training programs for youth, adults, and mature workers, worker retraining, Division of Vocational Rehabilitation, and information on unemployment insurance.
",,,WorkSource Whidbey,,,,,