name,alternate_name,x-status,x-verification,Service Area,phones,url,description,services,email,locations,contacts,x-website rating,x-logo,legal_status,x-status_last_modified
A Watered Garden Family Learning Center,,Vetted,,Whatcom County,(360) 393-9352,https://awateredgardenflc.weebly.com,"A non-profit faith based organization dedicated to offering educational and personal growth opportunities. Individuals and families build capacity to move from poverty to prosperity in their home and community through communication, cooperation, and collaboration.","ESL/ELL Classes (A Watered Garden),Conversational Spanish Classes (A Watered Garden),GED Class (A Watered Garden),U.S. Citizenship Class (A Watered Garden),Making SMILIES Learning Pathways for Children of Adult Learners,Basic Computer Skills (A Watered Garden),Community Garden (A Watered Garden),Nutrition Class (A Watered Garden)",awateredgardenflc@comcast.net,Everson Seventh Day Adventist Community Services Center,,,,,5/25/2022 7:53am
Answers Counseling,,Vetted,Answers Counseling,Whatcom County,(360) 255-7855,http://www.AnswersCounseling.org/,"Counseling, consulting, and case management services.","Answers Counseling Services,Infant Case Management,Answers Counseling Maternity Support Services,Answers Counseling Parenting Programs",,Bellingham Community Services Office (DSHS),,4,,,5/25/2022 7:31am
Bellingham Community Meal,,Vetted,Bellingham Community Meal,Whatcom County,(360) 647-5114,https://bellinghamcommunitymeal.square.site,"Provides a hearty meal for the community the last Saturday of the month, January through October.",Bellingham Community Meal ,,Assumption Catholic Church,,4,,,3/31/2022 3:27pm
Bellingham Food Bank,,Vetted,Bellingham Food Bank,Whatcom County,(360) 676-0392,http://www.bellinghamfoodbank.org/,Provides free groceries to anyone in Bellingham. Up to two visits per week allowed per household. Pick up for up to two households per visit.,Bellingham Food Bank,"info@bellinghamfoodbank.org
","Bellingham Food Bank,Christ the King Community Church Bellingham",,,,,3/16/2022 2:55pm
Bellingham Parks and Recreation,,Vetted,Bellingham Parks and Recreation,Whatcom County,(360) 778-7000,http://www.cob.org/parks,Supports a healthy community by providing high quality parks and recreation services.,"Arne Hanna Aquatic Center,Free Shower Program,Bellingham Playbook,City of Bellingham Community Garden Program",parks@cob.org,Bellingham Parks and Recreation,,5,,,6/13/2022 1:30pm
Bellingham Public Library,,Vetted,Bellingham Public Library,Whatcom County,(360) 778-7323,http://www.bellinghampubliclibrary.org/,"Serves the residents of Bellingham and Whatcom County with branches in Central Bellingham, Fairhaven, and Barkley.","Tech Help at BPL,Computers and Technology Access at BPL,WiFi Hotspot Lending at BPL,Meeting Rooms at BPL ,Free Museum Passes through BPL ,Outreach Services at BPL ,Nonprofit Resources at BPL,Teacher Resources at BPL,Learning Resources at BPL,Research Tools at BPL,BPL Calendar",,"Bellingham Public Library Central Branch,Bellingham Public Library Fairhaven Branch,Bellingham Public Library Barkley Branch",,5,,,6/28/2022 9:49am
Bellingham Public Schools,,Vetted,,Whatcom County,,https://bellinghamschools.org,"Public school district for Bellingham, WA.","Bellingham Family Resource Centers,McKinney-Vento Program (BPS),Promise Kindergarten,Child Find Preschool Screenings (BPS),Developmental Preschool (BPS),GRADS",,,,,,,3/23/2022 9:36am
Blaine Community Assistance Program,Blaine CAP,Vetted,Blaine CAP,Whatcom County,(360) 392-8484,https://blainecap.org/,"Serves the people of the Blaine, Birch Bay, Custer, and Point Roberts communities who are in need of assistance to meet their basic requirements for food, clothing, and other necessities of daily life.","CAP Crisis Assistance,Blaine Clothing Bank,Blaine and Birch Bay Community Toy Store,CAP Winter Coat Drive,The Food Connection,CAP Thanksgiving Baskets",info@blainecap.org,The CAP Center,,5,,,4/11/2022 2:53pm
Blaine Food Bank,,Vetted,,Whatcom County,(360) 332-6350,www.blainefoodbank.org,"Provides food to Blaine, Custer, Birch Bay, and Semiahmoo residents. Households can visit up to twice per week.",Blaine Food Bank,,Blaine Food Bank,,,,,3/23/2022 10:44am
Blaine School District,,Vetted,,Whatcom County,,https://www.blainesd.org,"Public school district for Blaine, Birch Bay, and Point Roberts, WA.","Blaine Family Service Center,McKinney-Vento Program (BSD) ,Developmental Preschool (BSD)",,,,,,,3/23/2022 9:50am
Blue Skies for Children,,Vetted,Blue Skies,Whatcom County,(360) 756-6710,http://www.blueskiesforchildren.org/,"Sponsors enrichment programs and other essentials for homeless, low-income and foster children in Whatcom and Skagit Counties.","Our Little Wishes Enrichment Program,Our One-Time Little Wishes Program,Our Little Wishes Instrument Loaner Program,Blue Skies Shoe Distribution Program,Blue Skies Back to School Backpack Distribution Program,Blue Skies Winter Warm-Up Distribution Program,Foster Grads Program,Blue Skies Driver's Education Scholarship   ,Swim to Live Program,""The Evan J. Sobjack Memorial Fund, Legends of Mt. Baker """,,Blue Skies for Children,,5,,,5/19/2022 11:06am
Brigid Collins Family Support Center,,Vetted,Brigid Collins,Whatcom County,(360) 734-4616,http://www.brigidcollins.org/," A commitment-based organization  dedicated to protecting children, building strong families, and ending child abuse. ","Parent Child Assistance Program,Familia Latina,Parent Child Interaction Therapy,Parenting Education (Brigid Collins),Stewards of Children",,Brigid Collins Family Support Center,,5,,,5/9/2022 3:28pm
Domestic Violence and Sexual Assault Services (DVSAS),DVSAS,Vetted,,Whatcom County,(360) 715-1563,http://www.dvsas.org/,"Supports individuals affected by domestic violence, sexual assault, and sexual exploitation, and provides community education. All services are free and confidential.","Ask an Advocate at DVSAS,Legal Assistance at DVSAS,DVSAS 24-Hour Helpline,DVSAS Advocacy Counseling,DVSAS Support Groups,DVSAS Safe Housing Program,DVSAS Professional Trainings",,DVSAS,,5,,,8/24/2022 8:42am
Ferndale Community Services,,Vetted,Ferndale Community Services,Whatcom County,(360) 380-2200,http://www.ferndalecsc.org ,A nonprofit organization whose mission is to understand and alleviate unmet needs by providing resources and connection. ,"Family Funds Program,Ferndale Community Utilities Fund,Ferndale Severe Weather Shelter,Ferndale Holiday Giving Store,Ferndale Other Bank,Ferndale Resource Center",info@ferndalecs.org,Ferndale Resource Center,,5,,,4/11/2022 3:41pm
Ferndale Food Bank ,,Vetted,,Whatcom County,(360) 223-0788,http://ferndalefoodbank.org,"Provides food to residents of the Ferndale/Custer area. Please bring a piece of identification (simply your photo with your name) and a Ferndale or Custer area utility bill containing your address with a zip code 98248, 98226, 98230, 98231, or 98240.",Ferndale Food Bank,director@ferndalefoodbank.org,Ferndale Food Bank,,,,,3/23/2022 10:47am
Ferndale School District,,Vetted,,Whatcom County,,https://www.ferndalesd.org,"Public school district for Ferndale, WA.","Ferndale Student Services,Ferndale Jump Start Kindergarten,McKinney-Vento Program (FSD),Child Find Screenings (FSD),Developmental Preschool (FSD)",,,,,,,3/23/2022 10:05am
Food Lifeline Mobile Pantry ,,Vetted,,Whatcom County,(360) 599-3944,,"Located at the East Whatcom Regional Resource Center every 1st Saturday of the Month, and 3rd Friday of the Month.  ",Food Lifeline Mobile Pantry,,East Whatcom Regional Resource Center,,1,,,3/31/2022 2:50pm
Foothills Food Bank ,,Vetted,,Whatcom County,(360) 392-8149,http://www.foothillsfoodbank.org,"Provides fresh and frozen produce, dairy products, meat, proteins, canned and dry goods, and bread. Please bring your own bags or boxes. ",Foothills Food Bank,,"Foothills Food Bank,Harmony Elementary School",,,,,3/23/2022 10:48am
Hope House,,Vetted,,Whatcom County,(360) 671-8702,https://www.assumption.org/hope-house.html,"Basic Needs provided free of charge to those in need in our community. Resources include clothing, household goods, toiletries, cleaning supplies, diapers, emergency food, and more. 
",Hope House,,Hope House,,,,,3/23/2022 10:50am
Interfaith Coalition,,Vetted,Interfaith Coalition,Whatcom County,(360) 734-3983,https://www.interfaith-coalition.org/,Serves people experiencing homelessness in Whatcom County.,"Family Promise,CAST,Interfaith Coalition Winter Warmth Drive",,Interfaith Coalition,,5,,,3/31/2022 3:21pm
Loaves and Fishes Community Meal,,Vetted,Loaves and Fishes,Whatcom County,(360) 734-4500,http://firstbaptistbellingham.com/connect/tuesday-meal,Free hot meal served weekly. ,Loaves and Fishes Community Meal,,First Baptist Church,,,,,3/31/2022 2:59pm
Lummi Food Bank  ,,Vetted,,Whatcom County,,,Commodity food program for income eligible Native Americans and non-tribal people who live on the reservation.,Lummi Food Bank,,Lummi Food Bank,,,,,3/23/2022 10:53am
Lummi Nation School,,Vetted,,Whatcom County,,https://www.lns-onlinelearning.org,A Tribally-Controlled School that serves grades K-12.,McKinney-Vento Program (Lummi),,,,,,,3/23/2022 10:07am
Lummi Tribal Health Center,,Vetted,Lummi Tribal Health Center,Whatcom County,(360) 384-0464,https://www.lummi-nsn.gov/Website.php?PageID=433,"Provides comprehensive health care including outpatient medical, dental, physical therapy, mental health, preventive healthcare and public health services for Lummi Tribal Members and other American Indian/Alaska Natives.","Lummi Tribal Health Center,Lummi Tribal Dental Clinic,Lummi Tribal WIC Program",,Lummi Tribal Health Center,,4,,,3/31/2022 3:32pm
Lynden School District,,Vetted,,Whatcom County,,https://lynden.wednet.edu,"Public school district for Lynden, WA.","Lynden Family Community Services,McKinney-Vento Program (LSD),Child Find Screenings (LSD)",,,,,,,3/23/2022 10:14am
Meridian School District,,Vetted,,Whatcom County,,https://www.meridian.wednet.edu,Public school district for the Meridian region of Whatcom County.,"Meridian Readiness to Learn,Meridian Transitional Kindergarten,Developmental Preschool (MSD)",,,,,,,3/23/2022 10:20am
Mount Baker School District,,Vetted,,Whatcom County,,https://www.mtbaker.wednet.edu,Public school district for Eastern Whatcom County.,"Mt. Baker Family Services,Mt. Baker Educational Resource Center,McKinney-Vento Program (MBSD),Child Find Screenings (MBSD)",,,,,,,3/23/2022 10:30am
Nooksack Food Bank ,,Vetted,,Whatcom County,(360) 592-0135,,Provides food to anyone in need on the first Friday of each month. Located behind the Social Services building.,Nooksack Food Bank,,Nooksack Food Bank,,,,,3/23/2022 10:58am
Nooksack Indian Health Department,Nooksack Tribal Health Center,Vetted,Nooksack Indian Health Department,Whatcom County,(360) 966-2106,https://nooksacktribe.org/departments/health/,"An innovative ambulatory health care center that serves members of the Nooksack Indian Tribe and the Tribal Member community. Also provides community health prevention and education services to ensure patients receive health care to the fullest extent including, Medical, Dental, Community Health/Health Nursing, Mental Health Counseling, Chemical Dependency Counseling, Chemical Dependency Prevention and Contract Health Services.","Nooksack Tribal Clinic,Nooksack Tribal Dental Clinic,Nooksack Behavioral Health,Nooksack Genesis II Chemical Dependency Program,Nooksack WIC Program",,"Nooksack Indian Health Department,Nooksack Behavioral Health",,5,,,3/31/2022 3:32pm
Nooksack Valley Food Bank ,,Vetted,,Whatcom County,,https://www.facebook.com/NooksackValleyFoodBank/,"Provides produce, canned goods, breads, meat, and dairy items. No ID or proof of address required. Income guidelines are currently 400% of Federal Poverty Level.",Nooksack Valley Food Bank,,"Nooksack Valley Food Bank Everson,Nooksack Valley Food Bank Sumas",,,,,3/23/2022 10:46am
Nooksack Valley School District,,Vetted,,Whatcom County,,https://www.nv.k12.wa.us,"Public school district for Everson, Nooksack, and Sumas, WA.","Nooksack Valley Early Childhood Program,McKinney-Vento Program (NVSD),Child Find Screenings (NVSD)",,,,,,,3/23/2022 10:35am
Opportunity Council,,Vetted,Opportunity Council,Whatcom County,(360) 734-5121,https://www.oppco.org,"A private, non-profit Community Action Agency serving homeless and low-income families and individuals. ","Early Head Start,Head Start,Child Care Aware of NW Washington,Single Entry Access to Services,Early Support for Infants and Toddlers (Opportunity Council),Child Care Nutrition Program,Emergency Child Care Voucher,Kinship Care,Opportunity Council Community Resource Center,East Whatcom Regional Resource Center,Basic Food Outreach,Opportunity Council Homeless Housing Programs,Whatcom Homeless Service Center,Homeless Outreach Team,Rental Assistance (Opportunity Council),Basic Food Employment and Training Program (Opportunity Council),Foundational Community Support Employment Program ,Financial Literacy and Renters Education,On the Money,Energy Assistance (Opportunity Council),Weatherization Program,Weatherization Plus Health Program,Home Repair Loan,City of Bellingham Mobile Home Repair,Conservation Education,Supportive Services for Veteran Families,Whatcom Volunteer Center,Needs Based Ferry Passes,WTA Bus Passes (Opportunity Council),Maple Alley Inn",,Opportunity Council Community Resource Center,,5,,,3/30/2022 11:40am
PeaceHealth,,Vetted,PeaceHealth,Whatcom County,,https://www.peacehealth.org,"A not-for-profit healthcare system with medical centers, critical access hospitals and medical clinics located in Washington, Oregon and Alaska.","PeaceHealth Pediatrics,PeaceHealth Family Medicine,PeaceHealth Behavioral Health,PeaceHealth Immediate Primary and Urgent Care,PeaceHealth Nutrition Services,PeaceHealth Primary Care,Pregnancy and Childbirth Care at PeaceHealth,PeaceHealth Women's Health,PeaceHealth Emergency Medicine",,"St. Joseph Medical Center,PeaceHealth at Cordata Main",,5,,,5/10/2022 4:20pm
Project Hope Lynden ,,Vetted,Project Hope,Whatcom County,(360) 354-4673,https://www.projecthopelynden.org,"A food bank and Community Assistance Program that helps Lynden community members with short-term, emergency assistance.

","Project Hope Food Bank,Project Hope Community Assistance",,Project Hope,,5,,,4/25/2022 3:42pm
Salvation Army,,Vetted,,Whatcom County,(360) 733-1410,http://bellingham.salvationarmy.org,"Provides food boxes, holiday programs, and Puget Sound Energy Assistance with urgent and/or shut off notice.","Salvation Army Energy Assistance ,Salvation Army Food Bank",,Salvation Army,,,,,3/23/2022 10:59am
Sea Mar Community Health Center,,Vetted,Sea Mar,Whatcom County,,https://www.seamar.org/index.html,"A community-based organization committed to providing quality, comprehensive health, human, educational and cultural services to diverse communities, specializing in service to Latinos. 
","Sea Mar Bellingham Medical Clinic,Sea Mar Everson Medical Clinic,Sea Mar Bellingham Dental Clinic,Sea Mar Bellingham Behavioral Health Clinic,Sea Mar Bellingham Behavioral Health Child and Family Services,Sea Mar Health Education,Sea Mar Maternity Support Services,Sea Mar WIC and Nutrition Program,Sea Mar Healthcare for the Homeless Program,Sea Mar Migrant and Seasonal Farmworker Promotores Program",,"Sea Mar Bellingham Medical Clinic,Sea Mar Everson Medical Clinic,Sea Mar Bellingham Dental Clinic,Sea Mar Bellingham Behavioral Health Clinic,Sea Mar Bellingham Downtown",,5,,,3/31/2022 3:31pm
Southside Food Bank,,Vetted,,Whatcom County,(360) 733-8400,https://www.hcbellingham.com/southside-food-bank/,Provides food to anyone in need. Open the first and third Thursday of each month.,Southside Food Bank,,Southside Food Bank,,,,,3/23/2022 11:00am
The Arc of Whatcom County,,Vetted,The Arc,Whatcom County,(360) 715-0170,http://arcwhatcom.org/wp/about-the-arc/dan-godwin-community-center/,"Works to improve the quality of life, increase the independence and assure the full inclusion in the community of all persons with developmental disabilities. The Arc acts as an information resource, linking persons with developmental disabilities and their families with available resources in the community.

","Parent Coalition,Parent to Parent Support Programs,Self-Advocacy Program,Down Syndrome Outreach Program,Medicaid Personal Care Parent Training,The Arc Legislative Advocacy",,The Arc of Whatcom County Dan Godwin Community Center,,5,,,5/19/2022 12:11pm
Tutu's Free Food Hotline ,,Vetted,Tutu's Free Food Hotline,Whatcom County,(360) 788-7EAT (7328),,A Project of Whatcom Anti-Hunger Coalition and Opportunity Council. People can call this number and get information on food banks and prepared meal served on each day of the week.,Tutu's Free Food Hotline,,,,,,,3/31/2022 2:55pm
Unity Care NW,,Vetted,Unity Care NW,Whatcom County,(360) 676-6177,https://unitycarenw.org,"A local, non-profit health care provider that is part of a national network of community health centers. Aims to improve access to health care for everyone, regardless of insurance status or ability to pay.

","Unity Care NW Primary and Preventative Health Care,Unity Care NW Children's Medical Care,Unity Care NW Adult Dental Care,Unity Care NW Children's Dental Care,Unity Care NW Behavioral Health",,"Unity Care NW Bellingham Medical and Children's Dental Services,""Unity Care NW Bellingham Adult Dental, Behavioral Health, Donations, and Administration"",Unity Care NW Bellingham Pharmacy,Unity Care NW Ferndale",,5,,,3/31/2022 3:31pm
Whatcom Center for Early Learning,WCEL,Vetted,WCEL,Whatcom County,(360) 671-3660,http://www.wcel.net/,"Providing comprehensive, family centered early intervention services for children ages birth to three with special needs.","Early Support for Infants and Toddlers (WCEL),Sensational Toddlers,WCEL Friends Playgroup,WCEL Drop-in Playgroups",,Whatcom Center for Early Learning,,5,,,5/19/2022 1:01pm
Whatcom County Health Department ,,Vetted,Whatcom County Health Department,Whatcom County,(360) 778-6000,http://www.co.whatcom.wa.us/health/,Health Department for Whatcom County.,"Nurse-Family Partnership,Whatcom County Veterans Program,Prevention Coalitions,Syringe Services Program",,"Whatcom County Health Department ,Whatcom County Health Department - State Street",,5,,,5/25/2022 7:51am
Whatcom County Library System,WCLS,Vetted,,Whatcom County,(360) 305-3600,http://www.wcls.org,"Library system for Whatcom County with branches in Blaine, Deming, Everson, Ferndale, Lummi Island, Lynden, Maple Falls, Point Roberts, South Whatcom, and Sumas. ","WCLS WiFi and Laptops,WCLS Printing Services,WCLS Meeting Spaces,WCLS Learning Resources,WCLS Community Resources,WCLS Events Calendar",,"Blaine Library,Deming Library,Everson Library,Ferndale Library,Island Library,Lynden Library,North Fork Library,Northwest Drive Library Express,Point Roberts Library,South Whatcom Library,Sumas Library",,,,,7/14/2022 10:12am
Bellingham Whatcom County Housing Authority,,Vetting In Progress,,Whatcom County,(360) 676-6887,http://www.bellinghamhousing.org/,"Hrs. M-F, 9am-4pm.  Subsidized housing options for income eligible households; includes Section 8, Project Based Section 8 and Public Housing.",,,Bellingham Whatcom County Housing Authority,,,,,8/17/2022 1:27pm
Boys and Girls Clubs of Whatcom County,,Vetting In Progress,,Whatcom County,(360) 738-3808 (corporate office),http://www.whatcomclubs.org/,"Impact kids through academic success, good citizenship, healthy lifestyles, and athletic programs.  Before and after school programs available.
Bellingham: 1715 Kentucky St. Bellingham 98229 - (360) 527-9777
Ferndale: 2015 Cherry St. Ferndale 98248 - (360) 384-0753
Lynden: 8800 Bender Rd. Lynden 98264 - (360) 354-9959
Blaine: 635 8th St, Blaine 98230 - (360) 332-3008",,,,,,,,6/13/2022 1:33pm
Catholic Community Services,,Vetting In Progress,,Whatcom County,(360) 676-2164,http://www.ccsww.org/,"Hrs. M-Th: 8am-6pm, F: 8am-5pm  Provides behavioral health assessments and services for children up to age 21 with state health insurance",,,Catholic Community Services,,,,,6/13/2022 1:33pm
Catholic Housing Services,,Vetting In Progress,,Whatcom County,(360) 671-1077,http://ccsww.org/get-help/housing/,Has units for low-income people and and persons with disabilities.  Units accessed through the housing pool at Opportunity Council.  ,,,Catholic Housing Services,,,,,6/13/2022 1:34pm
City Gate Apartments (Pioneer Human Services),,Vetting In Progress,,Whatcom County,Resident Manager: (360) 927-6533,http://www.pioneerhumanservices.org,"Permanent supportive housing for offender re-entry program. Clients must be homeless and referrals made by corrections officer, mental health counselor, shelter program or other referring agency on a case by case basis. Clean and Sober supervised program.",,joseph.nagel@p-h-s.com ,City Gate Apartments,,,,,6/13/2022 1:34pm
Compass Health ,,Vetting In Progress,,Whatcom County,(360) 676-2220,http://www.compasshealth.org ,Hrs. M-F: 8:30am-5:30pm. Offers comprehensive and personalized mental health and psychiatric outpatient services.,,,Compass Health,,,,,6/13/2022 1:34pm
Goodwill Job Training and Education Center ,,Vetting In Progress,,Whatcom County,(360) 738-0483,https://seattlegoodwill.org/locations/5,"Hrs: M-Th 9am-5pm, Fri by appt.  We offer FREE classes in a wide range of subjects, including English for Speakers of Other Languages (ESOL), Computers, GED Preparation, and Retail and Customer Service.",,,Goodwill Job Training and Education Center,,,,,6/13/2022 1:35pm
Hillcrest Chapel ,,Vetting In Progress,,Whatcom County,(360) 733-8400,,"Hrs. M-Th: 9am-4pm. Fri by Appointment. Emergency financial assistance for gas vouchers, food, utilities, and other emergency needs. Rental assistance not available. Call for information.",,,Hillcrest Church,,,,,6/13/2022 1:35pm
Home Rehabilitation Loan Program,,Vetting In Progress,,Whatcom County,(360) 778-8391,https://www.cob.org/services/housing/Pages/home-rehabilitation.aspx ,Hrs. M-F: 8am-5pm. Loan program to assist low and moderate income Bellingham City residents in making repairs to their homes with 0% and low interest loans.,,,Bellingham City Hall,,,,,6/13/2022 1:35pm
Kaleidoscope Play and Learn Groups,,Vetting In Progress,,Whatcom County,,,,,,,,,,,5/4/2022 4:07pm
Kids in Motion ,,Vetting In Progress,,Whatcom County,(412) 444-KIDS (5437),http://www.kidsinmotionclinic.org/,"Kids in Motion provides physical, occupational and speech therapy for children with neurodevelopmental disorders. Kids in Motion offers home based therapy services to support the development of successful strategies for daily living.  Children receive quality intervention and caregivers are empowered, all within the comfort of home.  Works out of Christ the King church on Tuesdays and Thursdays.  ",,,Christ the King Community Church Bellingham,,,,,6/13/2022 1:36pm
Kids Korner ,,Vetting In Progress,,Whatcom County,(360) 734-3858,http://kidskornerlearningcenter.net/home,"Hrs: M-F 6:30am-6:30pm Childcare for 1 to 5 years, provides Head Start services, toddler and preschool curriculum, meals included, accepts DSHS.    ",,,Kids Korner,,,,,6/13/2022 1:36pm
Kulshan Community Land Trust ,,Vetting In Progress,,Whatcom County,(360) 671-5600,http://www.kulshanclt.org/,Hrs. M-F: 9am-5pm. Non-profit working to create healthy communities through permanently affordable homeownership. See website for income qualifications.  Also have monthly home buyer education classes.,,,Kulshan Community Land Trust,,,,,6/13/2022 1:36pm
Law Advocates  ,,Vetting In Progress,,Whatcom County,(360) 671-6079,http://www.lawadvocates.org/,"Hrs. M-Th:9am-5pm, Fri:9am-12pm.  Offers free civil legal advice & referrals for low-income households. To determine eligibility and type of legal problem call the CLEAR line M-F 9:15am-12:15pm at 1-888-201-1014.  Also offers law clinics like Street Law, Tenant Clinic, and Access ID. Please see website for details on all Law Advocate programs and clinic times.",,,Law Advocates,,,,,6/13/2022 1:36pm
Lighthouse Mission  ,,Vetting In Progress,,Whatcom County,(360) 733-5120,http://www.thelighthousemission.org/,"Emergency shelter for single men and women. Limited space available for fathers with children and mother with teenage sons, medical respite, and men with special needs. Transitional housing for men. Prepared meals served daily, call for times.  ",,,Lighthouse Mission Ministries,,,,,6/13/2022 1:36pm
Little Cheerful Cafe Soup Kitchen ,,Vetting In Progress,,Whatcom County,,,"Mondays: 6-7pm, November-March. Provides a meal to the homeless community of Whatcom county, all are welcome.",,,Little Cheerful,,,,,5/4/2022 4:11pm
Love INC. ,,Vetting In Progress,,Whatcom County,(360) 671-6201,http://www.whatcomloveinc.org/ ,"Hrs: M-Th 9am-1pm. Services include budget counseling, furniture program, relational support, transportation to medical appointments with two-week advance notice, small home repair, bus pass and food voucher. Limited financial resources include prescription co-pays, back to work needs (such as work boots) and transportation funding for those who are homeless and moving into housing or a person escaping DV situation",,,Love INC,,,,,5/4/2022 4:11pm
Lummi Children’s Services ,,Vetting In Progress,,Whatcom County,(360) 384-2324,,"Hrs. M-F: 8am-4:30pm.  Provides a continuum of culturally relevant support services to children and families of the Lummy Nation in the area of foster care, alternative parental care, and intervention/prevention.",,,Lummi Children's Services,,,,,6/13/2022 1:36pm
